,publication,is_uni_newspaper,url,article_title,date,author,is_student
0,thehornettribune,1,https://asuhornettribune.com/14534/viewpoints/donald-trumps-conviction-a-reminder-of-many-things/,Donald Trump’s conviction a reminder of many things,2024-06-09,,
1,thehornettribune,1,https://asuhornettribune.com/14494/viewpoints/protests-of-a-different-color/,Protests of a different color,2024-05-18,,
2,thehornettribune,1,https://asuhornettribune.com/14472/viewpoints/justice-for-marilyn-mosby-and-other-black-women/,Justice for Marilyn Mosby and other Black women,2024-05-15,,
3,thehornettribune,1,https://asuhornettribune.com/14455/university-news/flowers-imparts-important-message-to-spring-2024-graduates/,Flowers imparts important message to Spring 2024 graduates,2024-05-03,,
4,thehornettribune,1,https://asuhornettribune.com/14441/university-news/14441/,International Student Association honors its graduating seniors,2024-05-01,,
5,thehornettribune,1,https://asuhornettribune.com/14434/university-news/university-makes-history-with-inaugural-hive-awards/,University makes history with inaugural Hive Awards for students,2024-04-28,,
6,thehornettribune,1,https://asuhornettribune.com/14418/university-news/cable-encourages-honor-students-to-travel-the-bridge-of-endurance/,Cable encourages honor students to travel the bridge of endurance,2024-04-27,,
7,thehornettribune,1,https://asuhornettribune.com/14409/university-news/president-emeritus-william-hamilton-harris-dies/,"President Emeritus William Harris, Ph.D., dies in Hilton Head, South Carolina",2024-04-20,,
8,thehornettribune,1,https://asuhornettribune.com/14448/university-news/14448/,Tracy V. Banks Memorial Oratorical Contest amplifies student voices,2024-04-16,,
9,thehornettribune,1,https://asuhornettribune.com/14324/university-news/fourteen-trailblazers-make-history-at-the-university/,Fourteen student trailblazers create history at Alabama State University,2024-04-16,,
10,wvua23,0,https://www.wvua23.com/local-naacp-says-more-is-needed-before-nicks-in-the-sticks-apology-accepted/,Local NAACP says more is needed before Nick’s in the Sticks apology accepted,2024-08-01,,
11,wvua23,0,https://www.wvua23.com/hot-weather-continues-isolated-storms-watching-the-tropics-thursday-pm-forecast-update/,Hot Weather Continues… Isolated Storms… Watching the Tropics… Thursday PM Forecast Update,2024-08-01,,
12,wvua23,0,https://www.wvua23.com/former-walker-county-jail-worker-pleads-guilty-in-death-of-anthony-tony-mitchell/,Former Walker County Jail worker pleads guilty in death of Anthony ‘Tony’ Mitchell,2024-08-01,,
13,wvua23,0,https://www.wvua23.com/health-matters-sleep-apnea/,Health Matters: Sleep apnea,2024-08-01,,
14,wvua23,0,https://www.wvua23.com/tuscaloosa-county-school-system-kicks-off-new-year-with-rally-for-staff/,Tuscaloosa County School System kicks off new year with rally for staff,2024-08-01,,
15,wvua23,0,https://www.wvua23.com/jasper-city-walker-county-schools-offering-dual-enrollment-through-bevill-state/,"Jasper City, Walker County schools offering dual enrollment through Bevill State",2024-08-01,,
16,wvua23,0,https://www.wvua23.com/1-embryo-wrongful-death-suit-dropped-another-remains-active/,"1 embryo wrongful death suit dropped, another remains active",2024-08-01,,
17,wvua23,0,https://www.wvua23.com/downtown-tuscaloosa-hosting-first-friday-aug-2/,Downtown Tuscaloosa hosting First Friday Aug. 2,2024-08-01,,
18,wvua23,0,https://www.wvua23.com/alabama-researchers-get-grant-focused-on-reducing-diesel-emissions-at-ports/,Alabama researchers get grant focused on reducing diesel emissions at ports,2024-08-01,,
19,wvua23,0,https://www.wvua23.com/stillman-college-athletics-named-gold-level-naia-champions-of-character-five-star-institute/,Stillman College Athletics Named Gold Level NAIA Champions of Character Five-Star Institute,2024-08-01,,
20,deltadigitalnewservice,0,https://deltanewsservice.com/2024/07/31/3-5-million-in-federal-funding-for-jonesboro-advances-in-u-s-senate/,$3.5 Million in Federal Funding for Jonesboro Advances in U.S. Senate,2024-07-31,,
21,deltadigitalnewservice,0,https://deltanewsservice.com/2024/07/29/new-football-teams-coming-to-nea/,New football teams coming to NEA,2024-07-29,,
22,deltadigitalnewservice,0,https://deltanewsservice.com/2024/05/31/legends-bbq-a-thriving-figure-of-the-nea-black-community/,Legends BBQ a thriving figure of the NEA black community,2024-05-31,,
23,deltadigitalnewservice,0,https://deltanewsservice.com/2024/05/23/nea-celebrates-local-diversity-with-cultural-expo/,NEA celebrates local diversity with cultural expo,2024-05-23,,
24,deltadigitalnewservice,0,https://deltanewsservice.com/2024/05/02/cityyouth-a-destination-for-youth-when-school-ends/,CityYouth a destination for youth when school ends,2024-05-02,,
25,deltadigitalnewservice,0,https://deltanewsservice.com/2024/05/01/nea-baptist-urgent-care-plus-opening-imaging-center/,NEA Baptist Urgent Care Plus opens imaging center,2024-05-01,,
26,deltadigitalnewservice,0,https://deltanewsservice.com/2024/05/01/mental-health-where-the-gym-comes-in-handy/,Mental health: where the gym comes in handy,2024-05-01,,
27,deltadigitalnewservice,0,https://deltanewsservice.com/2024/05/01/mama-2-mama-provides-for-local-community-of-mothers/,"Mama 2 Mama, a local nonprofit organization and podcast, provides free diapers and shelter to needy mothers",2024-05-01,,
28,deltadigitalnewservice,0,https://deltanewsservice.com/2024/05/01/brent-floating-farms-aims-to-revolutionize-agriculture/,Brent Floating Farms aims to “revolutionize agriculture”,2024-05-01,,
29,deltadigitalnewservice,0,https://deltanewsservice.com/2024/05/01/medicaid-unwinding-affects-over-13000-jonesboro-residents/,"Medicaid unwinding affects over 13,000 Jonesboro residents",2024-05-01,,
30,cronkitenewsdistribution,0,https://cronkitenews.azpbs.org/2024/08/01/u-s-gymnastics-men-women-medal/,U.S. men’s gymnastics team medals for first time since 2008 at Paris 2024 Olympics,2024-08-01,,
31,cronkitenewsdistribution,0,https://cronkitenews.azpbs.org/2024/08/01/taurasi-griner-copper-mercury-help-team-usa-womens-basketball/,"Taurasi, Griner, Copper: Mercury trio determined to help Team USA women’s basketball win gold",2024-08-01,,
32,cronkitenewsdistribution,0,https://cronkitenews.azpbs.org/2024/08/01/team-usa-athletes-work-out-high-performance-training-center/,"In quiet Paris suburb, Team USA elite athletes work out together at high performance training center",2024-08-01,,
33,cronkitenewsdistribution,0,https://cronkitenews.azpbs.org/2024/07/31/olympians-relationship-social-media-display-paris-games/,‘A 30% BMI’: Olympians’ love-hate relationship with social media on full display at Paris Games,2024-07-31,,
34,cronkitenewsdistribution,0,https://cronkitenews.azpbs.org/2024/07/31/after-5th-place-finish-in-time-trials-phoenixs-brandon-mcnulty-has-another-shot-for-olympic-gold-in-cycling-road-race/,"After 5th place finish in time trials, Phoenix’s Brandon McNulty has another shot for Olympic gold in cycling road race",2024-07-31,,
35,cronkitenewsdistribution,0,https://cronkitenews.azpbs.org/2024/07/30/arizona-canada-strengthen-ties-through-new-phoenix-trade-office/,Arizona and Canada strengthen ties through new Phoenix trade office,2024-07-30,,
36,cronkitenewsdistribution,0,https://cronkitenews.azpbs.org/2024/07/30/native-american-basketball-scholarships-keon-talgo-jaci-gonnie/,"Hoops and scholarships: Native American Basketball Invitational provides intense competition, life-altering moments",2024-07-30,,
37,cronkitenewsdistribution,0,https://cronkitenews.azpbs.org/2024/07/30/duchenne-muscular-dystrophy-gene-therapy-provides-hope/,Gene therapy provides hope for those with Duchenne muscular dystrophy – but not without concerns,2024-07-30,,
38,cronkitenewsdistribution,0,https://cronkitenews.azpbs.org/2024/07/30/arizona-teacher-shortages-persist-but-may-be-easing/,Teacher shortages persist in Arizona but may be easing,2024-07-30,,
39,cronkitenewsdistribution,0,https://cronkitenews.azpbs.org/2024/07/30/triathlete-kirsten-kasper-roads-waters-traveled-olympics/,From Scottsdale to Paris: ‘Snowbird’ triathlete Kirsten Kasper takes roads and waters less traveled to Paris Olympics,2024-07-30,,
40,zumedia,0,https://zunews.com/2024/05/tyler-howards-athletic-journey-at-apu/,Tyler Howard’s Athletic Journey at APU,2024-05-07,,
41,zumedia,0,https://zunews.com/2024/05/zu-magazine-vol-13-issue-1-so-what/,ZU Magazine: Vol. 13 Issue 1: “So What?”,2024-05-01,,
42,zumedia,0,https://zunews.com/2024/05/remembering-josh-millender-a-pillar-of-genuine-kindness/,Remembering Josh Millender: A pillar of “genuine kindness”,2024-05-01,,
43,zumedia,0,https://zunews.com/2024/04/issues-with-commuting-and-off-campus-housing/,Issues with Commuting and Off-Campus Housing,2024-04-25,,
44,zumedia,0,https://zunews.com/2024/04/taylor-swifts-the-tortured-poets-department-is-nothing-like-we-expected/,Taylor Swift’s “The Tortured Poets Department” is nothing like we expected,2024-04-25,,
45,zumedia,0,https://zunews.com/2024/04/the-scary-reality-of-nickelodeon/,The Scary Reality of Nickelodeon,2024-04-24,,
46,zumedia,0,https://zunews.com/2024/04/the-cold-weather-and-rain-continue-to-hit-azusa/,The cold weather and rain continue to hit Azusa,2024-04-22,,
47,zumedia,0,https://zunews.com/2024/04/scottie-scheffler-dominates-the-2024-masters-tournament/,Scottie Scheffler Dominates the 2024 Masters Tournament,2024-04-21,,
48,zumedia,0,https://zunews.com/2024/04/summertime-shenanigans/,Summertime Shenanigans,2024-04-18,,
49,zumedia,0,https://zunews.com/2024/04/movies-that-need-a-sequel/,Movies that need a sequel,2024-04-18,,
50,thepoint,1,https://thepointmagazine.org/4471/stories/cultural-roots-through-cuisine-finding-comfort-in-culinary-roots/,Cultural Roots Through Cuisine: Finding Comfort in Culinary Roots,2024-04-03,,
51,thepoint,1,https://thepointmagazine.org/4430/uncategorized/zihan-xu-china/,"Zihan Xu, China",2023-12-07,,
52,thepoint,1,https://thepointmagazine.org/4423/uncategorized/yaw-bay-myanmar/,"Yaw Bay, Myanmar",2023-12-07,,
53,thepoint,1,https://thepointmagazine.org/4416/uncategorized/perez-balikuddembe-uganda/,"Perez Balikuddembe, Uganda",2023-12-07,,
54,thepoint,1,https://thepointmagazine.org/4409/uncategorized/juan-manuel-nzamio-mba-andeme-equatorial-guinea/,"Juan Manuel Nzamio Mba Andeme, Equatorial Guinea",2023-12-07,,
55,thepoint,1,https://thepointmagazine.org/4401/uncategorized/joshua-janghyeok-kim/,"Joshua (Janghyeok) Kim, South Korea",2023-12-07,,
56,thepoint,1,https://thepointmagazine.org/4394/uncategorized/jesslyn-sudarta-indonesia/,"Jesslyn Sudarta, Indonesia",2023-12-07,,
57,thepoint,1,https://thepointmagazine.org/4387/uncategorized/janna-christian-gspd/,"Janna Christian, GSPD",2023-12-07,,
58,thepoint,1,https://thepointmagazine.org/4376/uncategorized/carolina-mussi-paraguay/,"Carolina Mussi, Paraguay",2023-12-07,,
59,thepoint,1,https://thepointmagazine.org/4356/stories/global/cross-cultural-stories/,Cross Cultural Stories,2023-12-07,,
60,theorion,1,https://theorion.com/100491/features/abandoned-shoes-in-chico-photo-series/,Abandoned shoes in Chico: photo series,2024-05-22,,
61,theorion,1,https://theorion.com/100413/food-2/the-orion-tries-the-dining-hall/,The Orion tries the dining hall,2024-05-21,,
62,theorion,1,https://theorion.com/100375/features/faculty-students-mental-health-continue-to-suffer/,"Faculty, students’ mental health continue to suffer",2024-05-20,,
63,theorion,1,https://theorion.com/100331/arts/names-horror-films-have-ruined-or-made-cool/,Names horror films have ruined … or made cool,2024-05-19,,
64,theorion,1,https://theorion.com/100370/arts/he-said-she-said-immaculate/,"He said, she said: ‘Immaculate’",2024-05-18,,
65,theorion,1,https://theorion.com/100337/features/meet-the-orions-fall-2024-editorial-board/,Meet The Orion’s fall 2024 editorial board!,2024-05-17,,
66,theorion,1,https://theorion.com/100476/news/chico-state-celebrates-graduate-studies-commencement/,Chico State celebrates Graduate Studies Commencement,2024-05-17,,
67,theorion,1,https://theorion.com/100334/arts/an-alt-girls-origin-story-emo-beginnings/,An alt-girl’s origin story: emo beginnings,2024-05-16,,
68,theorion,1,https://theorion.com/100392/features/congrats-the-orion-graduates/,Congrats to The Orion graduates!,2024-05-16,,
69,theorion,1,https://theorion.com/100384/news/a-final-wrap-up-of-stachura/,A final wrap up of Stachura,2024-05-15,,
70,universitytimes,1,https://csulauniversitytimes.com/encampment-dismantled/,"Police take down pro-Palestinian encampment, Eanes says ‘we will not negotiate’",2024-06-18,,
71,universitytimes,1,https://csulauniversitytimes.com/admin-building-overtaken/,"Encampment must go after Student Services Building vandalized, says Cal State LA president",2024-06-14,,
72,universitytimes,1,https://csulauniversitytimes.com/photo-essay-shakespeares-macbeth/,PHOTO ESSAY: Shakespeare’s ‘Macbeth’,2024-05-18,,
73,universitytimes,1,https://csulauniversitytimes.com/psilocybin-mushrooms-regain-popularity-as-researchers-look-for-new-ways-to-use-it/,Psilocybin mushrooms regain popularity as researchers look for new ways to use it,2024-05-17,,
74,universitytimes,1,https://csulauniversitytimes.com/video-arrest-made-in-the-death-of-former-cal-state-la-student/,Arrest made in the death of former Cal State LA student,2024-05-14,,
75,universitytimes,1,https://csulauniversitytimes.com/creating-one-final-masterpiece-from-movie-fanatic-to-special-fx-artist/,"Creating one final masterpiece, from movie fanatic to Special FX artist",2024-05-11,,
76,universitytimes,1,https://csulauniversitytimes.com/from-may-day-to-today-where-the-encampment-is-now/,From May Day to today: Where the encampment is now,2024-05-11,,
77,universitytimes,1,https://csulauniversitytimes.com/gen-z-latinos-fight-an-uphill-battle-to-reach-the-film-industry/,Gen Z Latinos Fight an Uphill Battle to Reach the Film Industry,2024-05-09,,
78,universitytimes,1,https://csulauniversitytimes.com/car-flips-over-next-to-hellman-bridge-crashing-into-three-cars/,"BREAKING: Car flips over next to Hellman bridge, crashing into three cars",2024-05-02,,
79,universitytimes,1,https://csulauniversitytimes.com/audio-story-cal-state-la-baseball-vs-cal-poly-pomona-apr-19-21-2024/,"AUDIO STORY: Cal State LA baseball VS Cal Poly Pomona. Apr. 19-21, 2024.",2024-05-01,,
80,collegiatenewsservice,0,https://voiceofoc.org/2024/06/fountain-valley-to-test-out-a-four-day-work-week-at-city-hall/,Fountain Valley to Test Out a Four-Day Work Week at City Hall,2024-06-04,,
81,collegiatenewsservice,0,https://voiceofoc.org/2024/05/stanton-city-leaders-dream-of-a-new-downtown/,Stanton City Leaders Dream of a New Downtown,2024-05-30,,
82,collegiatenewsservice,0,https://voiceofoc.org/2024/05/placentia-officials-raise-concerns-about-blank-check-to-construction-consultants/,Placentia Officials Raise Concerns About ‘Blank Check’ to Construction Consultants,2024-05-07,,
83,collegiatenewsservice,0,https://voiceofoc.org/2024/05/fountain-valley-allows-digital-freeway-advertising-will-drivers-be-distracted/,Fountain Valley Allows Digital Freeway Advertising; Will Drivers be Distracted?,2024-05-06,,
84,collegiatenewsservice,0,https://voiceofoc.org/2024/05/santa-ana-families-celebrate-dia-de-los-ninos-dia-de-los-libros/,"Santa Ana Families Celebrate Día de los Niños, Día de los Libros",2024-05-03,,
85,collegiatenewsservice,0,https://voiceofoc.org/2024/04/will-garden-grove-unified-video-stream-school-board-meetings/,Will Garden Grove Unified Video Stream School Board Meetings?,2024-04-30,,
86,collegiatenewsservice,0,https://voiceofoc.org/2024/04/breas-historic-old-railroad-tracks-expands-west-connecting-to-a-trail-in-north-oc/,"Brea’s Historic Old Railroad Tracks Expands West, Connecting to a Trail in North OC",2024-04-29,,
87,collegiatenewsservice,0,https://voiceofoc.org/2024/04/will-stanton-switch-to-publicly-funded-elections/,Will Stanton Switch to Publicly Funded Elections?,2024-04-25,,
88,collegiatenewsservice,0,https://voiceofoc.org/2024/04/laguna-beach-officials-consider-raising-taxes/,Laguna Beach Officials Consider Raising Taxes,2024-04-23,,
89,collegiatenewsservice,0,https://voiceofoc.org/2024/03/stanton-extends-ban-on-new-smoke-shops-in-crackdown-on-flavored-tobacco/,Stanton Extends Ban on New Smoke Shops in Crackdown on Flavored Tobacco,2024-03-19,,
90,collegiatenewsservice,0,https://voiceofoc.org/2024/02/making-it-easy-to-watch-local-government-from-home/,Making it Easy to Watch Local Government From Home,2024-02-21,,
91,collegiatenewsservice,0,https://voiceofoc.org/2023/12/la-habras-rent-relief-program-for-mobile-home-residents-sees-low-turnout-rate/,La Habra’s Rent Relief Program for Mobile Home Residents Sees Low Turnout Rate,2023-12-08,,
92,collegiatenewsservice,0,https://voiceofoc.org/2023/12/dana-point-delays-handing-out-new-short-term-rental-permits-until-next-year/,Dana Point Delays Handing Out New Short-Term Rental Permits Until Next Year,2023-12-05,,
93,collegiatenewsservice,0,https://voiceofoc.org/2023/12/los-alamitos-to-offer-local-businesses-funding-through-new-incentive-program/,Los Alamitos to Offer Local Businesses Funding Through New Incentive Program,2023-12-04,,
94,collegiatenewsservice,0,https://voiceofoc.org/2023/11/san-clemente-adopts-district-map-boundaries-still-under-debate/,"San Clemente Adopts District Map, Boundaries Still Under Debate",2023-11-30,,
95,collegiatenewsservice,0,https://voiceofoc.org/2023/11/rancho-santa-margarita-moves-forward-with-district-election-map/,Rancho Santa Margarita Moves Forward With District Election Map,2023-11-30,,
96,collegiatenewsservice,0,https://voiceofoc.org/2023/11/seal-beach-could-increase-parking-rates-by-50/,Seal Beach Could Increase Parking Rates by 50%,2023-11-28,,
97,collegiatenewsservice,0,https://voiceofoc.org/2023/11/stanton-restricts-pedestrian-activity-near-street-medians-and-drive-thrus/,Stanton Restricts Pedestrian Activity Near Street Medians and Drive-Thrus,2023-11-27,,
98,collegiatenewsservice,0,https://voiceofoc.org/2023/11/how-easy-is-it-to-tune-into-your-school-board-meeting/,How Easy is it to Tune Into Your School Board Meeting?,2023-11-22,,
99,collegiatenewsservice,0,https://voiceofoc.org/2023/11/dana-point-could-make-dozens-of-new-short-term-rental-permits-available/,Dana Point Could Make Dozens of New Short-Term Rental Permits Available,2023-11-20,,
100,pepperdine/seavercollegejournalismprogram,1,https://pepperdine-graphic.com/opinion-turn-academic-disappointment-into-motivation/?utm_source=rss&utm_medium=rss&utm_campaign=opinion-turn-academic-disappointment-into-motivation,Opinion: Turn Academic Disappointment into Motivation,2024-06-05,,
101,pepperdine/seavercollegejournalismprogram,1,https://pepperdine-graphic.com/advice-column-how-to-stay-motivated-for-the-gym/?utm_source=rss&utm_medium=rss&utm_campaign=advice-column-how-to-stay-motivated-for-the-gym,Advice Column: How To Stay Motivated for the Gym,2024-05-01,,
102,pepperdine/seavercollegejournalismprogram,1,https://pepperdine-graphic.com/solutions-journalism-climate-anxiety/?utm_source=rss&utm_medium=rss&utm_campaign=solutions-journalism-climate-anxiety,Solutions Journalism: Climate Anxiety,2024-04-25,,
103,pepperdine/seavercollegejournalismprogram,1,https://pepperdine-graphic.com/letter-from-the-team/?utm_source=rss&utm_medium=rss&utm_campaign=letter-from-the-team,Letter from the Team,2024-04-25,,
104,pepperdine/seavercollegejournalismprogram,1,https://pepperdine-graphic.com/impending-doom-youth-face-anxiety-as-the-planet-warms/?utm_source=rss&utm_medium=rss&utm_campaign=impending-doom-youth-face-anxiety-as-the-planet-warms,Impending Doom: Youth Face Anxiety as The Planet Warms,2024-04-25,,
105,pepperdine/seavercollegejournalismprogram,1,https://pepperdine-graphic.com/it-is-possible-climate-activism-helps-youth-cope-with-climate-anxiety/?utm_source=rss&utm_medium=rss&utm_campaign=it-is-possible-climate-activism-helps-youth-cope-with-climate-anxiety,It is possible: Climate activism helps youth cope with climate anxiety,2024-04-25,,
106,pepperdine/seavercollegejournalismprogram,1,https://pepperdine-graphic.com/mental-health-professionals-invite-conversations-and-questions-about-climate-anxiety/?utm_source=rss&utm_medium=rss&utm_campaign=mental-health-professionals-invite-conversations-and-questions-about-climate-anxiety,Mental health professionals invite conversations and questions about climate anxiety,2024-04-25,,
107,pepperdine/seavercollegejournalismprogram,1,https://pepperdine-graphic.com/planted-trees-religion-grows-solutions-to-youth-climate-anxiety/?utm_source=rss&utm_medium=rss&utm_campaign=planted-trees-religion-grows-solutions-to-youth-climate-anxiety,Planted Trees: Religion Grows Solutions to Youth Climate Anxiety,2024-04-25,,
108,pepperdine/seavercollegejournalismprogram,1,https://pepperdine-graphic.com/there-will-be-a-new-standard-pepperdine-welcomes-next-womens-basketball-head-coach/?utm_source=rss&utm_medium=rss&utm_campaign=there-will-be-a-new-standard-pepperdine-welcomes-next-womens-basketball-head-coach,‘There will be a New Standard’: Pepperdine Welcomes Next Women’s Basketball Head Coach,2024-04-25,,
109,pepperdine/seavercollegejournalismprogram,1,https://pepperdine-graphic.com/saddle-up-for-beyoncs-emotive-rodeo-in-cowboy-carter/?utm_source=rss&utm_medium=rss&utm_campaign=saddle-up-for-beyoncs-emotive-rodeo-in-cowboy-carter,Saddle Up for Beyoncé’s Emotive Rodeo in ‘COWBOY CARTER’,2024-04-25,,
110,eldon,1,https://eldonnews.org/print/2024/06/25/first-womens-wrestling-champ/,First women’s wrestling champ,2024-06-26,,
111,eldon,1,https://eldonnews.org/print/2024/06/25/opinions-on-opinons/,OPINIONS ON OPINONS,2024-06-26,,
112,eldon,1,https://eldonnews.org/print/2024/06/25/photos-i-made-for-other-people/,Photos I made for other people,2024-06-26,,
113,eldon,1,https://eldonnews.org/print/2024/06/20/5-movies-to-watch-for-the-rest-of-2024/,5 Movies to watch for the rest of 2024,2024-06-21,,
114,eldon,1,https://eldonnews.org/sports/2024/06/05/2024-cccaa-socal-champions/,2024 CCCAA SoCal Champions,2024-06-06,,
115,eldon,1,https://eldonnews.org/style/2024/06/05/santana-fridaynightmunchies-community-nightmarket/,IN PHOTOS: Friday Night Munchies,2024-06-05,,
116,eldon,1,https://eldonnews.org/top-stories/2024/06/05/santana-fridaynightmunchies-foodmarket-filipinofood-birria-soulfood-community/,Friday Night Munchies is Santa Ana’s community-grown food market,2024-06-05,,
117,eldon,1,https://eldonnews.org/news/2024/05/30/jodi-coffman-obituary/,Jodi Coffman Obituary,2024-05-30,,
118,eldon,1,https://eldonnews.org/top-stories/2024/05/29/slushcult-is-a-community-built-on-nostalgia/,SlushCult is a community built on nostalgia,2024-05-30,,
119,eldon,1,https://eldonnews.org/views/2024/05/29/five-of-my-most-anticipated-movies-for-the-rest-of-2024/,Five of my most anticipated movies for the rest of 2024,2024-05-29,,
120,oaklandnorth,1,https://oaklandnorth.net/2024/07/31/oakland-coliseum-sale-complete-budget-spared/,"Coliseum sale complete, erasing need for deep cuts to police and fire departments",2024-07-31,,
121,oaklandnorth,1,https://oaklandnorth.net/2024/07/29/oakland-alameda-county-resentencing-death-penalty/,Prosecutor bias alleged in two Alameda County death penalties headed for resentencings,2024-07-29,,
122,oaklandnorth,1,https://oaklandnorth.net/2024/07/24/oakland-radius-recycling-alameda-county-grand-jury-charges/,Alameda County grand jury probe leads to rare charges against an Oakland recycling business and its managers,2024-07-25,,
123,oaklandnorth,1,https://oaklandnorth.net/2024/07/24/oaklans-west-oakland-matters-arts-event/,Artists celebrate culture and community at “West Oakland Matters” event Saturday,2024-07-24,,
124,oaklandnorth,1,https://oaklandnorth.net/2024/07/12/oakland-newsom-sends-more-chp-officer-alameda-county/,"‘Disappointed’ with DA’s office, governor sends more CHP officers to Oakland",2024-07-13,,
125,oaklandnorth,1,https://oaklandnorth.net/2024/07/10/oakland-voters-asked-to-add-more-muscle-to-the-city-ethics-commission/,Oakland voters being asked to add muscle to the city’s Ethics Commission,2024-07-10,,
126,oaklandnorth,1,https://oaklandnorth.net/2024/07/08/oakland-century-old-league-of-women-voters-recruiting/,"‘We think people should be educated voters’: On 100th anniversary, Oakland League of Women Voters recruits new members to mission",2024-07-08,,
127,oaklandnorth,1,https://oaklandnorth.net/2024/06/25/oakland-arrests-mass-shooting-lake-merritt-16-victims/,Arrests made in chaotic night of violence that left 16 people wounded,2024-06-26,,
128,oaklandnorth,1,https://oaklandnorth.net/2024/06/24/oakland-mayor-thao-fbi-raid-this-wouldnt-have-gone-down-the-way-it-did-if-i-was-rich/,Mayor Thao speaks out on FBI raid: ‘This wouldn’t have gone down the way it did if I was rich.’,2024-06-25,,
129,oaklandnorth,1,https://oaklandnorth.net/2024/06/20/oakldn-fbi-raids-mayor-sheng-thaos-home/,FBI raids Oakland Mayor Sheng Thao’s home,2024-06-20,,
130,richmondconfidential,1,https://richmondconfidential.org/2024/07/29/richmond-rich-city-rides-bike-shop-no-burglary-police-investigating/,"No burglary at Rich City Rides, police say, pointing to possible dispute between bike shop’s partners.",2024-07-29,,
131,richmondconfidential,1,https://richmondconfidential.org/2024/07/27/richmond-parchester-mural-project/,Parchester mural project: It takes a village to color a community,2024-07-28,,
132,richmondconfidential,1,https://richmondconfidential.org/2024/07/19/richmond-wccusd-williams-lawsuit-over-teacher-vacancies/,"WCCUSD sued over teacher vacancies, building conditions",2024-07-20,,
133,richmondconfidential,1,https://richmondconfidential.org/2024/07/12/richmond-point-molate-sale-east-bay-regional-park-district/,"After much contention, Point Molate will become a park, under new agreement with city, tribe and state",2024-07-12,,
