,publication,is_uni_newspaper,url,article_title,date,author,is_student
2820,omahareader,0,https://thereader.com/2024/06/14/inside-out-2-review/,Emotions Are Dumb and Hard,2024-06-14,,
2821,omahareader,0,https://thereader.com/2024/06/14/omaha-bars-jell-o-shot-challenge-raises-money-for-food-banks-across-the-country/,Omaha bar’s ‘Jell-O Shot Challenge’ raises money for food banks across the country,2024-06-14,,
2822,lasvegasreviewjournal,0,https://www.reviewjournal.com/sports/todays-local-and-national-sports-schedule/,Sports on TV in Las Vegas,2024-08-02,,
2823,lasvegasreviewjournal,0,https://www.reviewjournal.com/opinion/letters/letter-oh-say-can-you-what-3106462/,"LETTER: Oh, say can you … what?",2024-08-02,,
2824,lasvegasreviewjournal,0,https://www.reviewjournal.com/opinion/drawing-board/cartoons-democrats-create-the-most-diabolical-torture-device-ever-invented-3106451/,CARTOONS: Democrats create the most diabolical torture device ever invented,2024-08-02,,
2825,lasvegasreviewjournal,0,https://www.reviewjournal.com/opinion/letters/letter-the-interstate-15-nightmare-3106447/,LETTER: The Interstate 15 nightmare,2024-08-02,,
2826,lasvegasreviewjournal,0,https://www.reviewjournal.com/opinion/opinion-columns/victor-joecks/victor-joecks-higher-pay-didnt-fix-ccsds-teacher-shortage-3106443/,VICTOR JOECKS: Higher pay didn’t fix CCSD’s teacher shortage,2024-08-02,,
2827,lasvegasreviewjournal,0,https://www.reviewjournal.com/opinion/editorials/editorial-russias-american-hostages-finally-return-home-3106439/,EDITORIAL: Russia’s American hostages finally return home,2024-08-02,,
2828,lasvegasreviewjournal,0,https://www.reviewjournal.com/opinion/commentary-the-risks-of-chinas-near-monopoly-on-minerals-3106435/,COMMENTARY: The risks of China’s near-monopoly on minerals,2024-08-02,,
2829,lasvegasreviewjournal,0,https://www.reviewjournal.com/crime/homicides/man-shot-dead-after-striking-ex-employer-with-suv-in-las-vegas-3106420/,Man shot dead after striking ex-employer with SUV in Las Vegas,2024-08-02,,
2830,lasvegasreviewjournal,0,https://www.reviewjournal.com/sports/unlv/unlv-football/3-things-to-watch-as-unlv-football-begins-fall-camp-3106391/,3 things to watch as UNLV football begins fall camp,2024-08-02,,
2831,lasvegasreviewjournal,0,https://www.reviewjournal.com/local/local-las-vegas/mother-of-man-killed-in-las-vegas-apartment-fire-recounts-search-for-body-3106305/,Mother of man killed in Las Vegas apartment fire recounts search for body,2024-08-02,,
2832,lasvegasreviewjournal,0,https://www.reviewjournal.com/sports/olympics/las-vegas-at-olympics-sandpiper-medals-with-ledecky-ace-powers-u-s-3106278/,Las Vegas at Olympics: Sandpiper medals with Ledecky; Ace powers U.S.,2024-08-02,,
2833,lasvegasreviewjournal,0,https://www.reviewjournal.com/news/nation-and-world/20-year-old-falls-400-feet-to-his-death-in-grand-canyon-3106274/,20-year-old falls 400 feet to his death in Grand Canyon,2024-08-02,,
2834,lasvegasreviewjournal,0,https://www.reviewjournal.com/business/casinos-gaming/bookmaker-to-plead-guilty-in-gambling-case-tied-to-ohtanis-ex-interpreter-3106264/,Bookmaker to plead guilty in gambling case tied to Ohtani’s ex-interpreter,2024-08-01,,
2835,lasvegasreviewjournal,0,https://www.reviewjournal.com/news/nation-and-world/israel-says-it-has-confirmed-that-chief-of-hamas-military-wing-was-killed-in-a-july-strike-3106257/,Israel says it has confirmed that chief of Hamas’ military wing was killed in a July strike,2024-08-01,,
2836,lasvegasreviewjournal,0,https://www.reviewjournal.com/sports/mma-ufc/ufc-306-1st-live-sporting-event-at-sphere-fetching-record-prices-3106250/,UFC 306 — 1st live sporting event at Sphere — fetching record prices,2024-08-01,,
2837,lasvegasreviewjournal,0,https://www.reviewjournal.com/news/nation-and-world/hezbollah-leader-says-war-with-israel-has-entered-new-phase-after-killings-of-top-militant-figures-3106243/,Hezbollah leader says war with Israel has entered ‘new phase’ after killings of top militant figures,2024-08-01,,
2838,lasvegasreviewjournal,0,https://www.reviewjournal.com/news/politics-and-government/las-vegas/las-vegas-owes-30m-in-back-interest-in-badlands-case-judge-rules-3106238/,"Las Vegas owes $30M in back interest in Badlands case, judge rules",2024-08-01,,
2839,lasvegasreviewjournal,0,https://www.reviewjournal.com/sports/raiders/raiders-rookies-already-making-presence-felt-at-training-camp-3106212/,Raiders rookies already making presence felt at training camp,2024-08-01,,
2840,lasvegasreviewjournal,0,https://www.reviewjournal.com/business/las-vegas-aviators-owner-separates-from-howard-hughes-3106206/,Las Vegas Aviators owner separates from Howard Hughes,2024-08-01,,
2841,lasvegasreviewjournal,0,https://www.reviewjournal.com/crime/courts/former-metro-detective-pleads-no-contest-to-attempted-libel-charge-3106195/,Former Metro detective pleads no contest to attempted libel charge,2024-08-01,,
2842,lasvegasreviewjournal,0,https://www.reviewjournal.com/local/traffic/i-15-near-strip-closing-to-traffic-this-weekend-as-pave-a-thon-continues-3106191/,I-15 near Strip closing to traffic this weekend as ‘Pave-A-Thon’ continues,2024-08-01,,
2843,lasvegasreviewjournal,0,https://www.reviewjournal.com/local/local-las-vegas/precautionary-landing-forces-metro-copter-onto-las-vegas-road-3106187/,‘Precautionary landing’ forces Metro copter onto Las Vegas road,2024-08-01,,
2844,lasvegasreviewjournal,0,https://www.reviewjournal.com/opinion/jonah-goldberg-its-hard-sharing-a-party-with-trump-or-vance-3106180/,JONAH GOLDBERG: It’s hard sharing a party with Trump or Vance,2024-08-01,,
2845,lasvegasreviewjournal,0,https://www.reviewjournal.com/business/casinos-gaming/two-major-las-vegas-strip-casino-operators-weigh-in-on-mirage-trop-closures-3106176/,"Two major Las Vegas Strip casino operators weigh in on Mirage, Trop closures",2024-08-01,,
2846,lasvegasreviewjournal,0,https://www.reviewjournal.com/sports/poker/caesars-sells-wsop-brand-for-500-million-keeps-live-events-3106163/,"Caesars sells WSOP brand for $500 million, keeps live events",2024-08-01,,
2847,lasvegasreviewjournal,0,https://www.reviewjournal.com/news/science-and-technology/after-freeway-fire-heres-what-you-should-know-about-lithium-ion-batteries-3106150/,"After freeway fire, here’s what you should know about lithium-ion batteries",2024-08-01,,
2848,lasvegasreviewjournal,0,https://www.reviewjournal.com/sports/olympics/simone-biles-edges-brazils-andrade-for-her-2nd-olympic-all-around-gymnastics-title-3106120/,Simone Biles edges Brazil’s Andrade for her 2nd Olympic all-around gymnastics title,2024-08-01,,
2849,lasvegasreviewjournal,0,https://www.reviewjournal.com/business/casinos-gaming/california-man-wins-1-4m-jackpot-at-las-vegas-airport-3106112/,California man wins $1.4M jackpot at Las Vegas airport,2024-08-01,,
2850,lasvegasreviewjournal,0,https://www.reviewjournal.com/entertainment/movies/movies-and-tv-shows-casting-in-las-vegas-3106108/,Movies and TV shows casting in Las Vegas,2024-08-01,,
2851,lasvegasreviewjournal,0,https://www.reviewjournal.com/business/tourism/las-vegas-hotel-room-bookings-sales-feel-soft-for-2024-f1-race-3106082/,"Las Vegas hotel room bookings, sales ‘feel soft’ for 2024 F1 race",2024-08-01,,
2852,nevadabusinessjournal,0,https://nevadabusiness.com/2024/08/heather-shuit-celebrates-20-years-with-camco-of-nevada/,Heather Shuit Celebrates 20 Years with CAMCO of Nevada,2024-08-01,,
2853,nevadabusinessjournal,0,https://nevadabusiness.com/2024/08/grand-sierra-resort-announces-nevada-mens-basketball-nil-initiative/,Grand Sierra Resort Announces Nevada Men’s Basketball NIL Initiative,2024-08-01,,
2854,nevadabusinessjournal,0,https://nevadabusiness.com/2024/08/get-ready-for-back-to-school-with-free-screenings-affordable-immunizations-at-walmart-wellness-day/,Get Ready for Back-to-School with Free Screenings & Affordable Immunizations at Walmart Wellness Day,2024-08-01,,
2855,nevadabusinessjournal,0,https://nevadabusiness.com/2024/08/hawthorn-grill-at-the-jw-marriott-las-vegas-resort-spa-earns-2024-wine-spectator-award-of-excellence-restaurant-award/,Hawthorn Grill at the JW Marriott Las Vegas Resort & Spa earns 2024 Wine Spectator Award of Excellence Restaurant Award,2024-08-01,,
2856,nevadabusinessjournal,0,https://nevadabusiness.com/2024/08/hemophilia-patient-receives-fda-approved-gene-therapy-treatment-likely-to-eliminate-the-need-for-preventative-factor-replacement/,Hemophilia Patient Receives FDA Approved Gene Therapy Treatment Likely To Eliminate The Need For Preventative Factor Replacement,2024-08-01,,
2857,nevadabusinessjournal,0,https://nevadabusiness.com/2024/08/grand-sierra-resort-reaches-architectural-milestone-for-new-arena/,Grand Sierra Resort Reaches Architectural Milestone for New Arena,2024-08-01,,
2858,nevadabusinessjournal,0,https://nevadabusiness.com/2024/07/tickets-are-now-available-for-prairiefire-nevadas-inaugural-national-swat-competition/,Tickets Are Now Available For PrairieFire Nevada’s Inaugural National SWAT Competition,2024-07-31,,
2859,nevadabusinessjournal,0,https://nevadabusiness.com/2024/07/las-vegas-south-premium-outlets-host-back-to-school-celebration-august-10/,"Las Vegas South Premium Outlets Host Back to School Celebration, August 10",2024-07-31,,
2860,nevadabusinessjournal,0,https://nevadabusiness.com/2024/07/12-nevada-based-organizations-receive-300k-in-support-from-googles-data-center-community-impact-program/,12 Nevada-based Organizations Receive $300K in Support from Google’s Data Center Community Impact Program,2024-07-31,,
2861,nevadabusinessjournal,0,https://nevadabusiness.com/2024/07/emerald-island-rainbow-club-casinos-unveil-joint-players-card/,Emerald Island & Rainbow Club Casinos Unveil Joint Players Card,2024-07-31,,
2862,nevadabusinessjournal,0,https://nevadabusiness.com/2024/07/lp-insurance-welcomes-valdez/,LP Insurance Welcomes Valdez,2024-07-31,,
2863,nevadabusinessjournal,0,https://nevadabusiness.com/2024/07/rampart-casino-announces-exciting-gaming-promotions-for-august/,Rampart Casino Announces Exciting Gaming Promotions for August,2024-07-30,,
2864,nevadabusinessjournal,0,https://nevadabusiness.com/2024/07/jw-marriott-las-vegas-resort-spa-announces-spa-pool-and-dining-offers-in-august/,"JW Marriott Las Vegas Resort & Spa Announces Spa, Pool and Dining Offers in August",2024-07-30,,
2865,nevadabusinessjournal,0,https://nevadabusiness.com/2024/07/prison-blues-tattoo-studio-opening-at-grand-sierra-resort/,Prison Blues Tattoo Studio Opening at Grand Sierra Resort,2024-07-30,,
2866,nevadabusinessjournal,0,https://nevadabusiness.com/2024/07/rscva-board-appoints-new-leadership/,RSCVA Board Appoints New Leadership,2024-07-26,,
2867,nevadabusinessjournal,0,https://nevadabusiness.com/2024/07/superb-maids-owner-buys-stake-in-las-vegas-based-carpet-monkeys/,Superb Maids Owner Buys Stake in Las Vegas-Based Carpet Monkeys,2024-07-26,,
2868,nevadabusinessjournal,0,https://nevadabusiness.com/2024/07/three-companies-bringing-130-jobs-to-southern-nevada/,Three Companies Bringing 130+ Jobs to Southern Nevada,2024-07-26,,
2869,nevadabusinessjournal,0,https://nevadabusiness.com/2024/07/pacific-storage-company-announces-rebranding-of-offsite-data-depot-to-pacific-records-management/,Pacific Storage Company Announces Rebranding of Offsite Data Depot to Pacific Records Management,2024-07-26,,
2870,nevadabusinessjournal,0,https://nevadabusiness.com/2024/07/las-vegas-rotary-club-honors-five-local-airmen-for-outstanding-work/,Las Vegas Rotary Club Honors Five Local Airmen for Outstanding Work,2024-07-25,,
2871,nevadabusinessjournal,0,https://nevadabusiness.com/2024/07/nevada-treasury-and-community-partners-to-host-a-back-to-school-fair-on-august-2/,Nevada Treasury and Community Partners to Host a Back To School Fair on August 2,2024-07-25,,
2872,newhampshiregazette,0,https://www.nhgazette.com/2024/07/29/mon-july-29/,"Mon, July 29",2024-07-29,,
2873,newhampshiregazette,0,https://www.nhgazette.com/2024/07/28/sun-july-28/,"Sun, July 28",2024-07-28,,
2874,newhampshiregazette,0,https://www.nhgazette.com/2024/07/27/lets-trump-proof-our-democracy/,Let’s Trump-Proof Our Democracy,2024-07-27,,
2875,newhampshiregazette,0,https://www.nhgazette.com/2024/07/27/there-really-is-still-time/,There Really Is Still Time,2024-07-27,,
2876,newhampshiregazette,0,https://www.nhgazette.com/2024/07/27/hot-enough-for-ya/,‘Hot Enough For Ya?’,2024-07-27,,
2877,newhampshiregazette,0,https://www.nhgazette.com/2024/07/27/why-bernie-sanders-is-thanking-elon-musk/,Why Bernie Sanders Is Thanking Elon Musk,2024-07-27,,
2878,newhampshiregazette,0,https://www.nhgazette.com/2024/07/27/sat-july-27/,"Sat, July 27",2024-07-27,,
2879,newhampshiregazette,0,https://www.nhgazette.com/2024/07/26/so-much-for-the-summer-doldrums/,So Much For The Summer Doldrums,2024-07-26,,
2880,newhampshiregazette,0,https://www.nhgazette.com/2024/07/26/volume-268-no-23-july-26-2024/,"Volume 268, No. 23; July 26, 2024",2024-07-26,,
2881,newhampshiregazette,0,https://www.nhgazette.com/2024/07/26/fri-july-26/,"Fri, July 26",2024-07-26,,
2882,businessnewsnj,0,https://njbiz.com/doherty-owned-applebees-fundraise-to-fight-childhood-cancer/,Doherty-owned Applebee’s fundraise to fight childhood cancer,2024-08-02,,
2883,businessnewsnj,0,https://njbiz.com/latest-citizens-business-conditions-index-shows-momentum-in-q2/,Latest Citizens Business Conditions Index shows momentum in Q2,2024-08-02,,
2884,businessnewsnj,0,https://njbiz.com/nj-lung-force-walk-celebrates-milestone-anniversary-photos/,NJ LUNG FORCE Walk celebrates milestone anniversary (photos),2024-08-02,,
2885,businessnewsnj,0,https://njbiz.com/abc-seeks-to-suspend-liquor-licenses-of-trenton-bar-owner/,ABC seeks to suspend liquor licenses of Trenton bar owner,2024-08-02,,
2886,businessnewsnj,0,https://njbiz.com/paris-baguette-debuts-refreshed-mobile-app-rewards-program/,"Paris Baguette debuts refreshed mobile app, rewards program",2024-08-02,,
2887,businessnewsnj,0,https://njbiz.com/gateway-commission-awards-465m-contract-offers-ceo-update/,"Gateway commission awards $465M contract, offers CEO update",2024-08-01,,
2888,businessnewsnj,0,https://njbiz.com/african-american-chamber-of-nj-to-receive-national-award/,African American Chamber of NJ to receive national award,2024-08-01,,
2889,businessnewsnj,0,https://njbiz.com/paramus-plaza-finds-new-owner-for-36-8m/,Paramus Plaza finds new owner for $36.8M,2024-08-01,,
2890,businessnewsnj,0,https://njbiz.com/njbiz-parent-bridgetower-media-acquires-virginia-business/,NJBIZ parent BridgeTower Media acquires Virginia Business,2024-08-01,,
2891,businessnewsnj,0,https://njbiz.com/wawa-adds-new-morris-county-store/,Wawa adds new Morris County store,2024-08-01,,
2892,hobbsnewssun,0,https://www.hobbsnews.com/2024/07/29/two-nmjc-athletes-to-compete-in-paris-olypmics/?utm_source=rss&utm_medium=rss&utm_campaign=two-nmjc-athletes-to-compete-in-paris-olypmics,Two NMJC athletes to compete in Paris Olypmics,2024-07-29,,
2893,hobbsnewssun,0,https://www.hobbsnews.com/2024/07/26/nm-tax-free-weekend-on-aug-2-4/?utm_source=rss&utm_medium=rss&utm_campaign=nm-tax-free-weekend-on-aug-2-4,NM tax-free weekend on Aug. 2-4,2024-07-26,,
2894,easthamptonstar,0,http://www.easthamptonstar.com/books/202481/alice-mcdermott-hits-fridays-five,Alice McDermott Hits Fridays at Five,2024-08-02,,
2895,easthamptonstar,0,http://www.easthamptonstar.com/books/202481/suddenly-one-summer,"Suddenly, One Summer",2024-08-02,,
2896,easthamptonstar,0,http://www.easthamptonstar.com/arts/202481/lordy-lordy-ltv-40,"Lordy, Lordy, LTV Is 40!",2024-08-01,,
2897,easthamptonstar,0,http://www.easthamptonstar.com/arts/202481/cowgirls-to-ride-longhouse,Neo-Political Cowgirls Ride at LongHouse,2024-08-01,,
2898,easthamptonstar,0,http://www.easthamptonstar.com/education/202481/teen-pager-new-book-column-teens-and-tweens,The Teen Pager: A New Book Column for Teens and Tweens,2024-08-01,,
2899,easthamptonstar,0,http://www.easthamptonstar.com/arts/202481/bits-and-pieces-080124,Bits and Pieces 08.01.24,2024-08-01,,
2900,easthamptonstar,0,http://www.easthamptonstar.com/arts/202481/art-scene-080124,The Art Scene 08.01.24,2024-08-01,,
2901,easthamptonstar,0,http://www.easthamptonstar.com/food/202481/news-foodies-080124,News for Foodies 08.01.24,2024-08-01,,
2902,easthamptonstar,0,http://www.easthamptonstar.com/arts/202481/jeff-harnar-to-sing-cole-porter,Jeff Harnar to Sing Cole Porter,2024-08-01,,
2903,easthamptonstar,0,http://www.easthamptonstar.com/arts/202481/seven-depot-gallery,Seven at the Depot Gallery,2024-08-01,,
2904,gardencitynews,0,https://www.gcnews.com/articles/marketplace-112/,Marketplace,2024-08-02,,
2905,gardencitynews,0,https://www.gcnews.com/articles/employment-113/,Employment,2024-08-02,,
2906,gardencitynews,0,https://www.gcnews.com/articles/announcements-115/,Announcements,2024-08-02,,
2907,gardencitynews,0,https://www.gcnews.com/articles/real-estate-wanted-44/,Real Estate Wanted,2024-08-02,,
2908,gardencitynews,0,https://www.gcnews.com/articles/services-111/,Services,2024-08-02,,
2909,gardencitynews,0,https://www.gcnews.com/articles/real-estate-for-rent-116/,Real Estate for Rent,2024-08-02,,
2910,gardencitynews,0,https://www.gcnews.com/articles/automotive-116/,Automotive,2024-08-02,,
2911,gardencitynews,0,https://www.gcnews.com/articles/national-politicians-their-years-in-garden-city/,National Politicians: Their Years in Garden City,2024-08-02,,
2912,gardencitynews,0,https://www.gcnews.com/articles/gc-board-approves-114k-toll-house-renovation-project/,GC Board approves $114K Toll House renovation project,2024-08-02,,
2913,gardencitynews,0,https://www.gcnews.com/articles/field-hockey-clinic-2/,Field Hockey Clinic,2024-08-02,,
2914,longislandbusinessnews,0,https://libn.com/2024/08/01/on-our-island-8-2-2024/,On Our Island 8/2/2024,2024-08-01,,
2915,longislandbusinessnews,0,https://libn.com/2024/08/01/manhasset-man-convicted-in-1b-fraud-scheme/,Manhasset man convicted in $1B fraud scheme,2024-08-01,,
2916,longislandbusinessnews,0,https://libn.com/2024/08/01/town-blamed-for-potential-safety-risk-at-east-hampton-airport/,Town blamed for potential safety risk at East Hampton Airport,2024-08-01,,
2917,longislandbusinessnews,0,https://libn.com/2024/08/01/keeping-it-in-the-family-running-a-multi-generational-real-estate-company/,Keeping it in the family: running a multi-generational real estate company,2024-08-01,,
2918,longislandbusinessnews,0,https://libn.com/2024/08/01/kornbluth-dont-let-hofstra-bully-nassau-residents-out-of-opportunity/,Kornbluth: Don’t let Hofstra bully Nassau residents out of opportunity,2024-08-01,,
2919,longislandbusinessnews,0,https://libn.com/2024/08/01/garret-taylor-coastline-wealth-management/,Garret Taylor | Coastline Wealth Management,2024-08-01,,
2920,longislandbusinessnews,0,https://libn.com/2024/08/01/long-island-historical-sites-get-45k-in-preservation-grants/,Long Island historical sites get $45K in preservation grants,2024-08-01,,
2921,longislandbusinessnews,0,https://libn.com/2024/08/01/capri-southampton-partners-with-real-estate-entrepreneur/,Capri Southampton partners with real estate entrepreneur,2024-08-01,,
2922,longislandbusinessnews,0,https://libn.com/2024/08/01/libn-parent-company-bridgetower-media-acquires-virginia-business/,LIBN parent company BridgeTower Media acquires Virginia Business,2024-08-01,,
2923,longislandbusinessnews,0,https://libn.com/2024/07/31/union-leader-durso-honored-at-annual-lia-golf-classic/,Union leader Durso honored at annual LIA Golf Classic,2024-07-31,,
2924,newyorkobserver,0,https://observer.com/2024/08/synthetic-data-ai-training/,Can Synthetic Data Help Solve Generative A.I.’s Training Data Crisis?,2024-08-02,,
2925,newyorkobserver,0,https://observer.com/list/best-tennis-skirts/,The Stylish Tennis Skirts to Sport on and Off the Court,2024-08-02,,
2926,newyorkobserver,0,https://observer.com/2024/08/review-the-gaudy-immersive-life-and-trust-is-part-theater-part-stunt/,"Review: The Gaudy, Immersive ‘Life and Trust’ Is Part Theater, Part Stunt",2024-08-02,,
2927,newyorkobserver,0,https://observer.com/2024/08/guide-to-august-art-fairs-august-art-fair-calendar/,Observer’s Guide to This Year’s Must-Visit August Art Fairs,2024-08-01,,
2928,newyorkobserver,0,https://observer.com/2024/08/preview-arts-exhibition-rashid-johnson-leon-golub-hauser-wirth/,Rashid Johnson Is Curating a Show Around Leon Golub’s Work at Hauser & Wirth,2024-08-01,,
2929,newyorkobserver,0,https://observer.com/2024/08/highest-paid-athletes-2024-paris-olympics/,Who Are the Highest-Paid Athletes at the 2024 Paris Olympics?,2024-08-01,,
2930,newyorkobserver,0,https://observer.com/2024/08/meta-q2-earnings-ai/,Mark Zuckerberg Warns Investors Meta’s A.I. Bet May Take ‘Years’ to Pay Off,2024-08-01,,
2931,newyorkobserver,0,https://observer.com/list/summer-hats-for-men/,21 Men’s Hats That Master Sun Protection and Casual Cool,2024-08-01,,
2932,newyorkobserver,0,https://observer.com/2024/08/review-woven-histories-exhibition-nga-national-gallery-canada-moma/,Rich Tapestries and Loose Ends: ‘Woven Histories’ Is Unwieldy in Its Comprehensiveness,2024-08-01,,
2933,newyorkobserver,0,https://observer.com/2024/08/art-collector-trevor-traina-significant-photo-collection-auction-christies/,Entrepreneur Trevor Traina On Building His Photo Collection and Sending It to Christie’s,2024-08-01,,
2934,newyorkobserver,0,https://observer.com/2024/08/jose-andres-bazaar-mar-las-vegas/,"Tableside Theatrics, Glamour and Great Food: José Andrés Opens Bazaar Mar on the Las Vegas Strip",2024-08-01,,
2935,newyorkobserver,0,https://observer.com/list/best-cbd-oil-for-dogs/,"10 Best CBD Oil for Dogs: Best for Anxiety, Pain & Arthritis",2024-07-31,,
2936,newyorkobserver,0,https://observer.com/2024/07/bill-ackman-cancel-pershing-square-ipo/,Bill Ackman Abruptly Cancels Pershing Square Fund IPO After Valuation Falls Short,2024-07-31,,
2937,newyorkobserver,0,https://observer.com/2024/07/paul-g-allen-art-computer-collection-christies-technology-auctions/,Even More of Paul G. Allen’s Massive Collection Is Coming to Christie’s,2024-07-31,,
2938,newyorkobserver,0,https://observer.com/2024/07/boeing-new-ceo-kelly-ortberg/,Boeing Appoints a New Turnaround CEO After Quarterly Loss Widened 250%,2024-07-31,,
2939,newyorkobserver,0,https://observer.com/2024/07/arts-responsibilities-restoration-conservation-contemporary-art-museums/,Contemporary Art Conservation Raises Thorny Issues Around Responsibility,2024-07-31,,
2940,newyorkobserver,0,https://observer.com/2024/07/space-missions-to-watch-august-2024/,Space Missions to Watch in August: SpaceX’s Busy Month With Starship and Polaris Dawn,2024-07-31,,
2941,newyorkobserver,0,https://observer.com/2024/07/microsoft-q2-earnings-ai-cloud/,Microsoft’s Cloud Revenue Disappoints But Satya Nadella Remains Committed to A.I. Spending,2024-07-31,,
2942,newyorkobserver,0,https://observer.com/2024/07/ashley-poston-romance-writer-interview/,"The Essentials With Author Ashley Poston: Disney, Local Bookstores and ‘A Novel Love Story’",2024-07-31,,
2943,newyorkobserver,0,https://observer.com/2024/07/interview-art-collector-craig-robins-baldessari/,Art Collector Spotlight: Craig Robins On Collecting Baldessari,2024-07-31,,
2944,putnamnewsandrecorder,0,https://www.pcnr.com/articles/breakneck-tunnel-closure/,Breakneck Tunnel Closure,2024-07-30,,
2945,putnamnewsandrecorder,0,https://www.pcnr.com/articles/garrison-educator-to-be-recognized-with-presidential-innovation-award/,Garrison Educator to be Recognized with Presidential Innovation Award,2024-07-30,,
2946,putnamnewsandrecorder,0,https://www.pcnr.com/articles/jennifer-colamonico-putnam-delegate-to-democratic-national-convention/,Jennifer Colamonico Putnam Delegate to Democratic National Convention,2024-07-30,,
2947,putnamnewsandrecorder,0,https://www.pcnr.com/articles/wealthy-putnam/,Wealthy Putnam,2024-07-30,,
2948,putnamnewsandrecorder,0,https://www.pcnr.com/articles/thousands-flock-to-putnam-country-fest/,Thousands Flock to Putnam Country Fest,2024-07-30,,
2949,putnamnewsandrecorder,0,https://www.pcnr.com/articles/real-estate-prices-through-the-roof/,Real Estate Prices Through the Roof,2024-07-30,,
2950,putnamnewsandrecorder,0,https://www.pcnr.com/articles/who-said-that/,Who Said That?,2024-07-30,,
2951,putnamnewsandrecorder,0,https://www.pcnr.com/articles/vape-disposal-boxes-available-in-putnam/,Vape Disposal Boxes Available in Putnam,2024-07-30,,
2952,putnamnewsandrecorder,0,https://www.pcnr.com/articles/attacking-food-insecurity/,Attacking Food Insecurity,2024-07-30,,
2953,putnamnewsandrecorder,0,https://www.pcnr.com/articles/slater-is-accessible-to-constituents/,Slater is Accessible to Constituents,2024-07-30,,
2954,thequeensgazette,0,https://www.qgazette.com/articles/ask-dr-universe-129/,Ask Dr. Universe,2024-08-01,,
2955,thequeensgazette,0,https://www.qgazette.com/articles/sixth-annual-queens-book-fair/,Sixth Annual Queens Book Fair,2024-08-01,,
2956,thequeensgazette,0,https://www.qgazette.com/articles/mtas-public-hearing-for-bus-redesign-proposed-final-plan/,MTA’s Public Hearing For Bus Redesign Proposed Final Plan,2024-08-01,,
2957,thequeensgazette,0,https://www.qgazette.com/articles/adams-awards-joel-key-to-the-city/,Adams Awards Joel Key To The City,2024-08-01,,
2958,thequeensgazette,0,https://www.qgazette.com/articles/poets-of-queens-releases-new-anthology/,Poets Of Queens Releases New Anthology,2024-08-01,,
2959,thequeensgazette,0,https://www.qgazette.com/articles/olena-jennings-performs-the-language-project-in-queens/,Olena Jennings Performs The Language Project In Queens,2024-08-01,,
2960,thequeensgazette,0,https://www.qgazette.com/articles/kids-must-have-shots-to-start-school-6/,Kids Must Have Shots to Start School,2024-08-01,,
2961,thequeensgazette,0,https://www.qgazette.com/articles/wave-makers-launch-splashdown-in-jackson-heights/,‘Wave Makers’ Launch Splashdown in Jackson Heights,2024-08-01,,
