,publication,is_uni_newspaper,url,article_title,date,author,is_student
1745,fortmorgantimes,0,https://www.fortmorgantimes.com/2024/08/02/your-free-daily-horoscope-for-august-2/,Your Free Daily Horoscope for August 2,2024-08-02,,
1746,fortmorgantimes,0,https://www.fortmorgantimes.com/2024/08/01/new-season-new-year-new-bears-northern-colorado-football-returns-with-new-helmets-for-2024/,"‘New season, new year, new Bears’: Northern Colorado football returns with new helmets for 2024",2024-08-02,,
1747,fortmorgantimes,0,https://www.fortmorgantimes.com/2024/08/01/three-storylines-to-follow-as-csu-opens-fall-camp/,Three storylines to follow as CSU opens fall camp,2024-08-02,,
1748,fortmorgantimes,0,https://www.fortmorgantimes.com/2024/08/01/colorado-states-final-four-includes-friday-edition-of-the-border-war/,Colorado State’s final four includes Friday edition of the Border War,2024-08-02,,
1749,fortmorgantimes,0,https://www.fortmorgantimes.com/2024/08/01/lab-seeks-to-include-rural-primary-care-patients-in-diabetes-research/,Lab seeks to include rural primary care patients in diabetes research,2024-08-01,,
1750,fortmorgantimes,0,https://www.fortmorgantimes.com/2024/08/01/kayaking-in-unusual-places-gives-a-unique-perspective-to-sightseeing/,Kayaking in unusual places gives a unique perspective to sightseeing,2024-08-01,,
1751,fortmorgantimes,0,https://www.fortmorgantimes.com/2024/08/01/chs-grain-bids-aug-1/,CHS Grain Bids Aug. 1,2024-08-01,,
1752,fortmorgantimes,0,https://www.fortmorgantimes.com/2024/08/01/why-cobb-salad-is-the-best-salad/,Why Cobb salad is the best salad,2024-08-01,,
1753,fortmorgantimes,0,https://www.fortmorgantimes.com/2024/08/01/grammy-museum-goes-crazy-for-k-pop-in-latest-exhibition/,Grammy museum goes crazy for K-pop in latest exhibition,2024-08-01,,
1754,greeleytribune,0,https://www.greeleytribune.com/2024/08/02/faces-of-homelessness-a-personal-look-into-the-stories-of-a-few-of-those-living-on-greeleys-streets/,Faces of homelessness: A personal look into the stories of a few of those living on Greeley’s streets,2024-08-02,,
1755,greeleytribune,0,https://www.greeleytribune.com/2024/08/02/asking-eric-wife-spills-friends-secret-to-bffs/,Asking Eric: Wife spills friend’s secret to BFFs,2024-08-02,,
1756,greeleytribune,0,https://www.greeleytribune.com/2024/08/02/your-free-daily-horoscope-for-august-2/,Your Free Daily Horoscope for August 2,2024-08-02,,
1757,greeleytribune,0,https://www.greeleytribune.com/2024/08/01/new-season-new-year-new-bears-northern-colorado-football-returns-with-new-helmets-for-2024/,"‘New season, new year, new Bears’: Northern Colorado football returns with new helmets for 2024",2024-08-02,,
1758,greeleytribune,0,https://www.greeleytribune.com/2024/08/01/rockies-nolan-jones-physical-battle/,Rockies’ Nolan Jones: “It’s been a mental and physical battle for me this year”,2024-08-02,,
1759,greeleytribune,0,https://www.greeleytribune.com/2024/08/01/broncos-quinn-bailey-out-for-season/,"Broncos OL Quinn Bailey out for season with dislocated ankle, fractured fibula",2024-08-02,,
1760,greeleytribune,0,https://www.greeleytribune.com/2024/08/01/confluence-water-managers-face-whatever-crisis-is-on-tap/,Confluence: Water managers face whatever crisis is on tap,2024-08-02,,
1761,greeleytribune,0,https://www.greeleytribune.com/2024/08/01/go-do-events-for-aug-2-7/,Go + Do events for Aug. 2-7,2024-08-02,,
1762,greeleytribune,0,https://www.greeleytribune.com/2024/08/01/greeley-city-council-moves-forward-with-study-of-west-side-project/,Greeley City Council moves forward with study of West Side Project,2024-08-02,,
1763,greeleytribune,0,https://www.greeleytribune.com/2024/08/01/three-storylines-to-follow-as-csu-opens-fall-camp/,Three storylines to follow as CSU opens fall camp,2024-08-02,,
1764,thelamardailynews,0,https://www.lamarledger.com/2024/08/01/harris-takes-polling-lead-but-voters-still-think-its-trumps-race-to-lose/,"Harris takes polling lead, but voters still think it’s Trump’s race to lose",2024-08-01,,
1765,thelamardailynews,0,https://www.lamarledger.com/2024/08/01/kayaking-in-unusual-places-gives-a-unique-perspective-to-sightseeing/,Kayaking in unusual places gives a unique perspective to sightseeing,2024-08-01,,
1766,thelamardailynews,0,https://www.lamarledger.com/2024/08/01/why-cobb-salad-is-the-best-salad/,Why Cobb salad is the best salad,2024-08-01,,
1767,thelamardailynews,0,https://www.lamarledger.com/2024/08/01/grammy-museum-goes-crazy-for-k-pop-in-latest-exhibition/,Grammy museum goes crazy for K-pop in latest exhibition,2024-08-01,,
1768,thelamardailynews,0,https://www.lamarledger.com/2024/08/01/the-cdcs-test-for-bird-flu-works-but-it-has-issues/,"The CDC’s test for bird flu works, but it has issues",2024-08-01,,
1769,thelamardailynews,0,https://www.lamarledger.com/2024/08/01/bird-flu-cases-are-going-undetected-new-study-suggests-its-a-problem-for-all-of-us/,"Bird flu cases are going undetected, new study suggests. It’s a problem for all of us",2024-08-01,,
1770,thelamardailynews,0,https://www.lamarledger.com/2024/08/01/simone-biles-painful-history-with-mykayla-skinner-coincided-with-larry-nasser-abuse-toxic-karolyi-culture/,"Simone Biles’ painful history with MyKayla Skinner coincided with Larry Nasser abuse, ‘toxic’ Karolyi culture",2024-08-01,,
1771,thelamardailynews,0,https://www.lamarledger.com/2024/08/01/olympics-2024-athletes-cant-get-enough-of-this-chocolate-muffin-on-tiktok/,Olympics 2024: Here’s where to get the chocolate muffins Olympians can’t get enough of,2024-08-01,,
1772,thelamardailynews,0,https://www.lamarledger.com/2024/07/31/colorado-wildfires-quarry-alexander-mountain-residents-evacuation-calls/,"As wildfires sweep through the Front Range, residents ponder whether to stay or go",2024-08-01,,
1773,thelamardailynews,0,https://www.lamarledger.com/2024/07/31/colorado-wildfires-alexander-mountain-stone-canyon/,"Four wildfires in three days along Colorado’s Front Range span more than 9,500 acres, force thousands to evacuate",2024-08-01,,
1774,northfortynews,0,https://northfortynews.com/category/new-scene/art-news/colorado-pickleball-group-announces-sale-of-15-new-franchises-for-the-picklr-along-front-range/,Colorado Pickleball Group Announces Sale of 15 New Franchises for the Picklr Along Front Range,2024-08-02,,
1775,northfortynews,0,https://northfortynews.com/category/news/northern-colorado-disaster-recovery-fund-to-support-alexander-mountain-fire-response-and-recovery-efforts/,Northern Colorado Disaster Recovery Fund to Support Alexander Mountain Fire Response and Recovery Efforts,2024-08-02,,
1776,northfortynews,0,https://northfortynews.com/category/business-education/10-things-to-pay-for-with-crypto-in-colorado/,10 Things to Pay For with Crypto in Colorado,2024-07-31,,
1777,northfortynews,0,https://northfortynews.com/category/sports/how-could-bogdan-bogdanovic-join-nikola-jokic-on-the-nuggets/,How Could Bogdan Bogdanovic Join Nikola Jokic on the Nuggets?,2024-07-31,,
1778,northfortynews,0,https://northfortynews.com/category/business-education/common-types-of-office-accidents-covered-by-workers-compensation/,Common Types of Office Accidents Covered by Worker’s Compensation,2024-07-31,,
1779,northfortynews,0,https://northfortynews.com/category/news/the-ranch-events-complex-confirms-2024-larimer-county-fair-and-prca-rodeo-amidst-wildfire-evacuations/,The Ranch Events Complex Confirms 2024 Larimer County Fair and PRCA Rodeo Amidst Wildfire Evacuations,2024-07-31,,
1780,northfortynews,0,https://northfortynews.com/category/news/larimer-county-declares-formal-disaster-emergency-for-alexander-mountain-fire/,Larimer County Declares Formal Disaster Emergency for Alexander Mountain Fire,2024-07-31,,
1781,northfortynews,0,https://northfortynews.com/category/news/more-evacuations-as-a-result-of-area-wildfires-in-larimer-and-boulder-counties/,More Evacuations as a Result of Area Wildfires in Larimer and Boulder Counties,2024-07-30,,
1782,northfortynews,0,https://northfortynews.com/category/gardens-landscapes/moonlight-gardens/,Moonlight Gardens,2024-07-30,,
1783,northfortynews,0,https://northfortynews.com/category/news/alexander-mountain-fire-prompts-mandatory-evacuation/,Alexander Mountain Fire Near Loveland Prompts Mandatory Evacuations,2024-07-29,,
1784,steamboatpilot,0,https://www.steamboatpilot.com/news/stagecoach-residents-sound-off-at-discovery-water-district-annexation-meeting/,Stagecoach residents sound off at Discovery water district annexation meeting,2024-08-02,,
1785,steamboatpilot,0,https://www.steamboatpilot.com/news/steamboat-springs-celebrates-impact-of-top-local-business-leaders-with-2024-navigator-awards/,Steamboat Springs celebrates impact of top local business leaders with 2024 Navigator Awards,2024-08-01,,
1786,steamboatpilot,0,https://www.steamboatpilot.com/news/explore-more-17/,Explore more,2024-08-01,,
1787,steamboatpilot,0,https://www.steamboatpilot.com/news/volunteers-drive-to-idaho-to-collect-weed-fighting-beetles/,Volunteers drive to Idaho to collect weed-fighting beetles,2024-08-01,,
1788,steamboatpilot,0,https://www.steamboatpilot.com/news/colorado-voters-will-be-asked-whether-to-ban-mountain-lion-bobcat-hunting-on-november-ballot/,"Colorado voters will be asked whether to ban mountain lion, bobcat hunting on November ballot",2024-08-01,,
1789,steamboatpilot,0,https://www.steamboatpilot.com/news/tales-from-the-tread-celebrating-local-summer-olympians/,Tales from the Tread: Celebrating local Summer Olympians,2024-08-01,,
1790,steamboatpilot,0,https://www.steamboatpilot.com/news/all-arts-week-closes-this-weekend-with-a-sea-of-experiences-in-steamboat-springs/,All Arts Week closes this weekend with a sea of experiences in Steamboat Springs,2024-08-01,,
1791,steamboatpilot,0,https://www.steamboatpilot.com/news/moffat-county-balloon-festival-to-soar-with-expansive-schedule/,Moffat County Balloon Festival to soar with expansive schedule,2024-08-01,,
1792,steamboatpilot,0,https://www.steamboatpilot.com/news/local-photographer-noah-wetzel-unveils-surreal-perspectives-at-first-friday-artwalk/,Local photographer Noah Wetzel unveils ‘Surreal Perspectives’ at First Friday Artwalk,2024-08-01,,
1793,steamboatpilot,0,https://www.steamboatpilot.com/news/steamboat-springs-winter-sports-club-scholarship-day-set-for-saturday/,Steamboat Springs Winter Sports Club Scholarship Day set for Saturday,2024-08-01,,
1794,steamboatpilot,0,https://www.steamboatpilot.com/news/big-wave-surfing-film-rescheduled-for-tuesday/,Big wave surfing film rescheduled for Tuesday,2024-08-01,,
1795,steamboatpilot,0,https://www.steamboatpilot.com/news/seminars-at-steamboat-an-increasingly-aggressive-china/,Seminars at Steamboat: An increasingly aggressive China,2024-08-01,,
1796,steamboatpilot,0,https://www.steamboatpilot.com/news/washington-tribe-rescinds-offer-to-send-colorado-15-wolves/,Washington tribe rescinds offer to send Colorado 15 wolves,2024-08-01,,
1797,steamboatpilot,0,https://www.steamboatpilot.com/news/routt-county-candidate-forum-touches-on-a-range-of-topics-from-brown-ranch-and-sbt-grvl-to-abortion/,Routt County candidate forum touches on a range of topics from Brown Ranch and SBT GRVL to abortion,2024-08-01,,
1798,steamboatpilot,0,https://www.steamboatpilot.com/news/longtime-steamboat-resident-takes-helm-at-hala-gear-as-steamboat-based-company-paddles-into-fresh-waters/,Longtime Steamboat resident takes helm at Hala Gear as Steamboat-based company paddles into fresh waters,2024-08-01,,
1799,steamboatpilot,0,https://www.steamboatpilot.com/news/colorado-parks-and-wildlife-confirms-eight-sheep-killed-by-wolves/,Colorado Parks and Wildlife confirms eight sheep killed by wolves,2024-08-01,,
1800,steamboatpilot,0,https://www.steamboatpilot.com/news/state-provides-air-quality-info-via-colorado-smoke-blog/,State provides air quality info via Colorado Smoke Blog,2024-07-31,,
1801,steamboatpilot,0,https://www.steamboatpilot.com/news/registration-opens-for-2024-25-winter-sports-club-winter-programs-on-thursday/,Registration opens for 2024-25 Winter Sports Club Winter programs on Thursday,2024-07-31,,
1802,steamboatpilot,0,https://www.steamboatpilot.com/news/sunday-shakespeare-on-the-library-lawn/,37 Shakespeare plays in 75 minutes coming to library Sunday,2024-07-31,,
1803,steamboatpilot,0,https://www.steamboatpilot.com/opinion/guest-column-western-colorado-leaders-plan-for-an-all-of-the-above-energy-future/,Guest column: Western Colorado leaders plan for an ‘all of the above’ energy future,2024-07-31,,
1804,summitdailynews,0,https://www.summitdaily.com/news/summit-school-district-bond-proposal/,Here’s what’s in Summit School District’s $195 million bond proposal,2024-08-02,,
1805,summitdailynews,0,https://www.summitdaily.com/news/jake-canter-us-ski-snowboard-team-domestic-violence/,Jake Canter not under consideration for US Ski & Snowboard Team due to domestic violence case,2024-08-02,,
1806,summitdailynews,0,https://www.summitdaily.com/news/xcel-energy-provides-statement-on-string-of-4-power-outages-in-4-days-in-summit-county/,Xcel Energy provides statement on string of 4 power outages in 4 days in Summit County,2024-08-02,,
1807,summitdailynews,0,https://www.summitdaily.com/news/22-year-old-who-allegedly-flashed-gun-ran-from-police-prompting-breckenridge-lockdown-has-significant-criminal-record/,"Man who allegedly flashed gun, ran from police during Breckenridge lockdown has ‘significant’ criminal record, hearing reveals",2024-08-01,,
1808,summitdailynews,0,https://www.summitdaily.com/news/mountain-bikers-rush-across-tenmile-range-for-peaks-trail-time-trial/,Mountain bikers rush across Tenmile Range for Peaks Trail Time Trial,2024-08-01,,
1809,summitdailynews,0,https://www.summitdaily.com/news/summit-police-dog-baby-blue-dies/,Death of Summit County Sheriff’s Office’s drug-sniffing dog casts uncertainty over future of local K9 program,2024-08-01,,
1810,summitdailynews,0,https://www.summitdaily.com/news/barney-flow-trail-in-breckenridge-currently-closed-for-maintenance/,Barney Flow Trail in Breckenridge currently closed for maintenance,2024-08-01,,
1811,summitdailynews,0,https://www.summitdaily.com/explore-summit/this-week-in-history-cleaning-a-toxic-mine-repealing-firebreak-rule-ski-pass-changes/,"This week in history: Cleaning a toxic mine,  repealing firebreak rule, ski pass changes",2024-08-01,,
1812,summitdailynews,0,https://www.summitdaily.com/news/opinion-tony-jones-thoughts-on-private-resorts/,Opinion | Tony Jones: Thoughts on private ski resorts and what they may do to the already expensive industry,2024-08-01,,
1813,summitdailynews,0,https://www.summitdaily.com/news/opinion-ari-rabin-havt-lets-never-be-that-type-of-community/,Opinion | Ari Rabin-Havt: Let’s never be that type of community,2024-08-01,,
1814,summitdailynews,0,https://www.summitdaily.com/news/from-the-publisher-introducing-the-new-weekend-edition-of-summit-daily-news/,From the Publisher: Introducing the new weekend edition of Summit Daily News,2024-08-01,,
1815,summitdailynews,0,https://www.summitdaily.com/news/county-commons-wolves-2/,County Commons: Wolves,2024-08-01,,
1816,summitdailynews,0,https://www.summitdaily.com/news/snowmass-liquor-store-awaits-purchaser-to-claim-over-5-7-million-lottery-ticket/,Snowmass liquor store awaits purchaser to claim over $5.7 million lottery ticket,2024-08-01,,
1817,summitdailynews,0,https://www.summitdaily.com/news/keystone-growth-development-guide/,Keystone begins yearlong effort to develop town’s first-ever guiding document for future growth and development,2024-08-01,,
1818,summitdailynews,0,https://www.summitdaily.com/news/colorado-ballot-question-mountain-lion-hunting/,"Colorado voters will be asked whether to ban mountain lion, bobcat hunting on November ballot",2024-08-01,,
1819,summitdailynews,0,https://www.summitdaily.com/news/xcel-energy-reports-another-outage-impacting-about-2600-summit-county-customers/,3rd outage in 2 days in Summit County is resolved,2024-08-01,,
1820,summitdailynews,0,https://www.summitdaily.com/news/lockdown-issued-for-near-colorado-highway-9-and-huron-road-in-breckenridge/,UPDATE: 22-year-old man arrested in connection with hourslong lockdown in Breckenridge neighborhood,2024-08-01,,
1821,summitdailynews,0,https://www.summitdaily.com/news/breckenridge-housing-project-skier-parking/,Breckenridge debates details of affordable housing project slated to be built on Airport Road free skier parking lot,2024-08-01,,
1822,summitdailynews,0,https://www.summitdaily.com/news/keystone-parking-regulations-ordinance/,Town of Keystone parking regulations come into focus as council discusses draft ordinance,2024-08-01,,
1823,summitdailynews,0,https://www.summitdaily.com/news/summit-county-sheriff-log-paraglider-wildfire/,"Summit County Sheriff’s Office helps with an I-70 driver fleeing police, paraglider crash and multiple incidents involving drinking",2024-08-01,,
1824,waterburyrepublicanamerican,0,https://www.rep-am.com/e-edition/2024/08/02/wa0802a01/,Today’s Edition,2024-08-02,,
1825,waterburyrepublicanamerican,0,https://www.rep-am.com/sports/sports-featured/2024/08/01/gallery-naugatuck-17u-takes-on-west-hartford-blue-in-legion-state-tourney/,GALLERY: Naugatuck 17U takes on West Hartford Blue in Legion state tourney,2024-08-02,,
1826,waterburyrepublicanamerican,0,https://www.rep-am.com/news/2024/08/01/4-las-vegas-teens-agree-to-plead-guilty-as-juveniles-in-deadly-beating-of-high-school-student/,4 Las Vegas teens agree to plead guilty as juveniles in deadly beating of high school student,2024-08-02,,
1827,waterburyrepublicanamerican,0,https://www.rep-am.com/news/2024/08/01/bookmaker-to-plead-guilty-in-gambling-case-tied-to-baseball-star-shohei-ohtanis-ex-interpreter/,Bookmaker to plead guilty in gambling case tied to baseball star Shohei Ohtani’s ex-interpreter,2024-08-02,,
1828,waterburyrepublicanamerican,0,https://www.rep-am.com/community/2024/08/01/winsteds-robert-bergmann-retires-from-navy/,Winsted’s Robert Bergmann retires from Navy,2024-08-02,,
1829,waterburyrepublicanamerican,0,https://www.rep-am.com/community/2024/08/01/zion-baptist-honors-amirrah-skeet/,Zion Baptist honors Amirrah Skeet,2024-08-02,,
1830,waterburyrepublicanamerican,0,https://www.rep-am.com/community/2024/08/01/sun-moon-and-stars-has-event-at-quassy/,"Sun, Moon and Stars has event at Quassy",2024-08-02,,
1831,waterburyrepublicanamerican,0,https://www.rep-am.com/community/2024/08/01/barry-trains-to-be-a-navy-chaplain/,Barry trains to be a Navy chaplain,2024-08-02,,
1832,waterburyrepublicanamerican,0,https://www.rep-am.com/community/2024/08/01/rossi-to-participate-in-triathlon/,Rossi to participate in triathlon,2024-08-02,,
1833,waterburyrepublicanamerican,0,https://www.rep-am.com/morning_5/2024/08/01/morning-5-women-olympic-champions/,Morning 5: Women Olympic champions,2024-08-02,,
1834,waterburyrepublicanamerican,0,https://www.rep-am.com/community/2024/08/01/fifth-grader-saluted-for-6-year-perfect-attendance/,Fifth-grader saluted for 6-year perfect attendance,2024-08-02,,
1835,waterburyrepublicanamerican,0,https://www.rep-am.com/news/2024/08/01/federal-judge-overturns-4-7-billion-jury-verdict-in-sunday-ticket-lawsuit-and-rules-for-nfl/,Federal judge overturns $4.7 billion jury verdict in ‘Sunday Ticket’ lawsuit and rules for NFL,2024-08-02,,
1836,waterburyrepublicanamerican,0,https://www.rep-am.com/news/2024/08/01/algeria-boxer-imane-khelif-wins-first-olympic-fight-when-opponent-angela-carini-quits/,Algeria boxer Imane Khelif wins first Olympic fight when opponent Angela Carini quits,2024-08-02,,
1837,waterburyrepublicanamerican,0,https://www.rep-am.com/sports/2024/08/01/naugatuck-junior-legion-knocked-out-in-states/,Naugatuck Junior Legion knocked out in states,2024-08-02,,
1838,waterburyrepublicanamerican,0,https://www.rep-am.com/life-arts/2024/08/01/landfill-waste-serves-new-purpose-in-mattatucks-latest-exhibit/,Landfill waste serves new purpose in Mattatuck’s latest exhibit,2024-08-02,,
1839,waterburyrepublicanamerican,0,https://www.rep-am.com/life-arts/2024/08/01/doggie-day-trips-help-ease-stress-of-shelter-life/,Doggie day trips help ease stress of shelter life,2024-08-02,,
1840,waterburyrepublicanamerican,0,https://www.rep-am.com/life-arts/2024/08/01/tips-from-decor-experts-for-a-comfortable-functional-dorm-room/,"Tips from decor experts for a comfortable, functional dorm room",2024-08-02,,
1841,waterburyrepublicanamerican,0,https://www.rep-am.com/life-arts/2024/08/01/yazidi-community-shuns-children-born-to-mothers-of-islamic-captivity/,Yazidi community shuns children born to mothers of Islamic captivity,2024-08-02,,
1842,waterburyrepublicanamerican,0,https://www.rep-am.com/life-arts/2024/08/01/so-many-words-but-nothing-to-say/,"So many words, but nothing to say",2024-08-02,,
1843,waterburyrepublicanamerican,0,https://www.rep-am.com/localnews/2024/08/01/man-to-face-charges-for-sexual-abuse-of-naugatuck-child/,Man to face charges for sexual abuse of Naugatuck child,2024-08-02,,
1844,waterburyrepublicanamerican,0,https://www.rep-am.com/localnews/2024/08/01/new-milford-man-admits-to-crimes-against-stepdaughter/,New Milford man admits to crimes against stepdaughter,2024-08-02,,
1845,waterburyrepublicanamerican,0,https://www.rep-am.com/localnews/2024/08/01/noteworthy-in-north-county-the-history-of-norfolks-castle/,NOTEWORTHY IN NORTH COUNTY: The history of Norfolk’s ‘castle’,2024-08-02,,
1846,waterburyrepublicanamerican,0,https://www.rep-am.com/localnews/2024/08/01/waterburys-oldest-building-sold/,Waterbury’s oldest building sold,2024-08-02,,
1847,waterburyrepublicanamerican,0,https://www.rep-am.com/localnews/2024/08/01/waterbury-adds-a-new-way-to-fight-crime/,Waterbury adds a new way to fight crime,2024-08-02,,
1848,waterburyrepublicanamerican,0,https://www.rep-am.com/localnews/2024/08/01/torrington-uses-eversource-funds-to-upgrade-five-buildings/,Torrington uses Eversource funds to upgrade five buildings,2024-08-02,,
1849,waterburyrepublicanamerican,0,https://www.rep-am.com/localnews/2024/08/01/91st-litchfield-county-4-h-fair-set-in-goshen/,91st Litchfield County 4-H Fair set in Goshen,2024-08-02,,
1850,waterburyrepublicanamerican,0,https://www.rep-am.com/obituaries/2024/08/01/william-f-campbell/,William F. Campbell,2024-08-02,,
1851,waterburyrepublicanamerican,0,https://www.rep-am.com/obituaries/2024/08/01/heru-wind-stone-dihaan/,Heru Wind Stone Dihaan,2024-08-02,,
1852,waterburyrepublicanamerican,0,https://www.rep-am.com/obituaries/2024/08/01/james-macdonald/,"James MacDonald,",2024-08-02,,
1853,waterburyrepublicanamerican,0,https://www.rep-am.com/obituaries/2024/08/01/maria-luisa-rebimbas-oliveira/,Maria Luisa Rebimbas Oliveira,2024-08-02,,
1854,bocabeacon,0,https://bocabeacon.com/james-griffith-is-open-all-summer-long/,James Griffith is open all summer long!,2024-08-01,,
1855,bocabeacon,0,https://bocabeacon.com/ecowatch-are-whales-sending-us-an-s-o-s/,EcoWatch: Are whales sending us an S.O.S.,2024-08-01,,
1856,bocabeacon,0,https://bocabeacon.com/sw-florida-fishing-big-reds-snapper-that-is/,SW Florida Fishing: Big reds … snapper that is,2024-08-01,,
1857,bocabeacon,0,https://bocabeacon.com/turtle-patrol-reporting-on-how-we-report-plus-hidden-disturbances/,"Turtle Patrol: Reporting on how we report, plus ‘hidden’ disturbances",2024-08-01,,
1858,bocabeacon,0,https://bocabeacon.com/gasparilla-magazine-beacon-win-state-awards/,"Gasparilla Magazine, Beacon win state awards",2024-08-01,,
1859,bocabeacon,0,https://bocabeacon.com/amenities-at-boca-grande-community-center-to-close-for-construction/,Amenities at Boca Grande Community Center to close for construction,2024-08-01,,
1860,bocabeacon,0,https://bocabeacon.com/in-the-spotlight-front-line-voice-for-island-first-responders-julie-brooks/,"IN THE SPOTLIGHT: Front line voice for island first responders, Julie Brooks",2024-08-01,,
1861,bocabeacon,0,https://bocabeacon.com/prummell-elected-president-of-florida-sheriffs-association/,Prummell elected president of Florida Sheriffs Association,2024-08-01,,
1862,bocabeacon,0,https://bocabeacon.com/real-estate-chart-july-21-27-2024/,"Real Estate Chart: July 21-27, 2024",2024-08-01,,
1863,bocabeacon,0,https://bocabeacon.com/new-rsw-flights-in-fall/,New RSW flights in fall,2024-08-01,,
1864,lakecityreporter,0,https://www.lakecityreporter.com/sports/prep-football-heat-lightning-hindering-first-week-practice-columbia,"PREP FOOTBALL: Heat, lightning hindering first week of practice at Columbia",2024-08-02,,
1865,lakecityreporter,0,https://www.lakecityreporter.com/sports-newsletter/prep-football-santa-fe-transfer-rb-keimarion-neal-ready-take-role-fort-white,PREP FOOTBALL: Santa Fe transfer RB Keimarion Neal ready to take on role in Fort White offense,2024-08-02,,
1866,lakecityreporter,0,https://www.lakecityreporter.com/local/desantis-declares-storm-emergency,DeSantis declares storm emergency,2024-08-01,,
1867,lakecityreporter,0,https://www.lakecityreporter.com/sports-newsletter/prep-football-legendary-coach-mike-pittman-lending-helping-hand-suwannee,PREP FOOTBALL: Legendary coach Mike Pittman lending a helping hand at Suwannee,2024-08-01,,
1868,lakecityreporter,0,https://www.lakecityreporter.com/local-newsletter/only-you-can-sing-happy-birthday-smokey-bears-80th-birthday-bash-set-saturday,‘Only you can sing Happy Birthday’: Smokey Bear’s 80th birthday bash set for Saturday,2024-07-31,,
1869,lakecityreporter,0,https://www.lakecityreporter.com/regional/lafayette-fleet-recharged-new-year,Lafayette fleet recharged for new year,2024-07-31,,
1870,lakecityreporter,0,https://www.lakecityreporter.com/local/tax-office-offers-license-event-students,Tax office offers license event for students,2024-07-31,,
1871,lakecityreporter,0,https://www.lakecityreporter.com/local/candidates-invited-address-community,Candidates invited to address community,2024-07-31,,
