,publication,is_uni_newspaper,url,article_title,date,author,is_student
884,borderzine,0,https://borderzine.com/2024/05/sisd-spring-games-are-a-win-for-special-needs-athletes-volunteers-and-family/,"SISD spring games are a win for special needs athletes, volunteers and family",2024-05-29,,
885,borderzine,0,https://borderzine.com/2024/04/once-a-grand-residential-thoroughfare-el-pasos-historic-montana-avenue-district-evolves-as-commercial-zone/,"Once a grand residential thoroughfare, El Paso’s historic Montana Avenue district evolves as commercial zone",2024-04-20,,
886,borderzine,0,https://borderzine.com/2024/04/texas-struggles-to-diversify-its-mental-health-workforce-to-reflect-changing-community-demographics/,Texas struggles to diversify its mental health workforce to reflect changing community demographics,2024-04-20,,
887,borderzine,0,https://borderzine.com/2024/04/mexican-immigration-agent-charged-in-juarez-migrant-center-fire-free-on-bail/,Mexican immigration agent charged in Juárez migrant center fire free on bail,2024-04-20,,
888,borderzine,0,https://borderzine.com/2024/04/apply-2023-dow-jones-news-fund-multimedia-training-academy-2/,Apply for the 2024 Dow Jones News Fund Multimedia Training Academy,2024-04-19,,
889,borderzine,0,https://borderzine.com/2024/04/apply-multimedia-journalism-internship-stipends-summer-2024/,Summer 2024 internship stipend application for UTEP Multimedia Journalism students,2024-04-18,,
890,sanantonioreport,0,https://sanantonioreport.org/standardized-tests-are-shifting-at-saisd-schools-heres-how/,Standardized tests are shifting at SAISD schools. Here’s how.,2024-08-02,,
891,sanantonioreport,0,https://sanantonioreport.org/americans-freed-in-historic-u-s-russia-prisoner-swap-will-be-evaluated-at-bamc/,Americans freed in historic U.S.-Russia prisoner swap will be evaluated at BAMC,2024-08-02,,
892,sanantonioreport,0,https://sanantonioreport.org/nirenberg-rebukes-havrda-for-proposing-eleventh-hour-charter-amendments/,Nirenberg rebukes Havrda for proposing eleventh-hour charter amendments,2024-08-01,,
893,sanantonioreport,0,https://sanantonioreport.org/valero-being-a-good-neighbor-and-building-a-better-tomorrow-sponsored/,"Valero, being a good neighbor and building a better tomorrow",2024-08-01,,
894,sanantonioreport,0,https://sanantonioreport.org/h-e-b-launches-pilot-program-using-digital-wallets-and-tap-to-pay/,H-E-B launches pilot program using digital wallets and tap-to-pay,2024-08-01,,
895,sanantonioreport,0,https://sanantonioreport.org/san-antonio-weekend-events-first-friday-movies-book-fair-art-opening/,"A book fair, a cult classic and Doritos preparados in this weekend’s ‘Go Do That!’",2024-08-01,,
896,sanantonioreport,0,https://sanantonioreport.org/joint-base-san-antonio-502nd-air-base-wing-welcomes-new-commander/,"Joint Base San Antonio, 502nd Air Base Wing welcomes new commander",2024-08-01,,
897,sanantonioreport,0,https://sanantonioreport.org/tv-movies-filmed-in-san-antonio-eligible-for-city-incentives/,"San Antonio wants to attract filmmakers, but small productions often don’t make the cut",2024-08-01,,
898,sanantonioreport,0,https://sanantonioreport.org/bimbo-bakeries-lay-off-138-shutter-san-antonio-bakery/,Bimbo Bakeries will lay off 138 and shutter its San Antonio bakery,2024-07-31,,
899,sanantonioreport,0,https://sanantonioreport.org/feds-extend-decision-period-for-adding-edwards-aquifer-dwelling-fish-to-endangered-species-list/,Feds extend decision period for adding Edwards Aquifer-dwelling fish to endangered species list,2024-07-31,,
900,texasmetronews,0,https://texasmetronews.com/78413/black-business-dojo-of-kickz/,Black Business: Dojo Of Kickz,2024-08-01,,
901,texasmetronews,0,https://texasmetronews.com/78410/end-hepatitis-by-2030-5-experts-explain/,End Hepatitis by 2030: 5 Experts Explain,2024-07-31,,
902,texasmetronews,0,https://texasmetronews.com/78407/fearless-fund-ceo-urges-biden-to-take-executive-action-on-dei/,Fearless Fund CEO Urges Biden To Take Executive Action On DEI,2024-07-31,,
903,texasmetronews,0,https://texasmetronews.com/78404/frank-stewarts-nexus-makes-its-final-stop-in-brandywine/,‘Frank Stewart’s Nexus’ makes it’s final stop in Brandywine,2024-07-31,,
904,texasmetronews,0,https://texasmetronews.com/78401/a-younger-jackson-state-to-hit-the-field-in-2024-2/,A younger Jackson State to hit the field in 2024,2024-07-31,,
905,texasmetronews,0,https://texasmetronews.com/78397/project-2025-the-blueprint-for-americas-democratic-demise/,Project 2025: The Blueprint for America’s Democratic Demise,2024-07-31,,
906,texasmetronews,0,https://texasmetronews.com/78393/before-simone-shacarri-and-snoop-olympics-boxing-was-king/,"Before Simone, Sha’Carri and Snoop, Olympics boxing was king",2024-07-31,,
907,texasmetronews,0,https://texasmetronews.com/78389/fbi-dallas-makes-arrest-in-derby-desperado-bank-robbery-case/,FBI Dallas makes arrest in ‘Derby Desperado’ bank robbery case,2024-07-31,,
908,texasmetronews,0,https://texasmetronews.com/78386/gov-moore-signs-executive-order-making-state-resources-more-accessible/,Gov. Moore signs executive order making state resources more accessible,2024-07-31,,
909,texasmetronews,0,https://texasmetronews.com/78383/nnpa-demands-nabj-rescind-invitation-to-donald-trump/,NNPA Demands NABJ Rescind Invitation to Donald Trump,2024-07-31,,
910,planomagazine,0,https://planomagazine.com/celebrate-the-arts-2024/,Celebrate the Arts event to return for 3rd year at the Courtyard Theatre,2024-07-31,,
911,planomagazine,0,https://planomagazine.com/pepsico-agriculture-internship/,PepsiCo Foods North America offers agriculture internship,2024-07-31,,
912,planomagazine,0,https://planomagazine.com/things-to-do-this-aug-2024/,Things to do this August,2024-07-30,,
913,planomagazine,0,https://planomagazine.com/bread-winners-30th-year-event/,Bread Winners Cafe celebrates 30th anniversary with event,2024-07-24,,
914,planomagazine,0,https://planomagazine.com/bioworld-partners-with-ntfb/,The Bioworld Foundation partners with North Texas Food Bank to feed North Texans,2024-07-17,,
915,planomagazine,0,https://planomagazine.com/texas-womens-foundation-board-including-planoite/,"Texas Women’s Foundation announces new board, including Planoite Holly Tucker",2024-07-17,,
916,planomagazine,0,https://planomagazine.com/kennys-burger-joint-rib-challenge/,"Kenny’s Burger Joint announces rib-eating challenge, crowns first winner",2024-07-17,,
917,planomagazine,0,https://planomagazine.com/warby-parker-store-opening/,Warby Parker store opening in Preston Park Colonnade,2024-07-17,,
918,planomagazine,0,https://planomagazine.com/13-5-million-tom-muehlenbeck/,Plano city council approves $13.5 million contract for renovations at Tom Muehlenbeck center,2024-07-16,,
919,planomagazine,0,https://planomagazine.com/plano-str-registration-new-rules/,"Plano short term rental registration deadline approaching, new rules added",2024-07-16,,
920,capitalnewsservice,0,https://swvatoday.com/article_23b6b0d0-0572-11ef-ae69-af3a40ff98ed.html,Both sides of Virginia recreational cannabis debate tout improved health and safety,2024-04-29,,
921,capitalnewsservice,0,https://royalexaminer.com/number-of-incarcerated-pregnant-women-increases-amid-opioid-epidemic/,Incarcerated pregnant women fighting addiction need specific resources,2024-04-29,,
922,capitalnewsservice,0,https://www.pilotonline.com/2024/04/26/virginia-delegate-hopes-to-end-states-high-black-maternal-mortality-rate/,Delegate hopes to end Virginia’s high Black maternal mortality rate,2024-04-29,,
923,capitalnewsservice,0,https://www.vpm.org/2024-04-26/richmond-restaurant-tax,Richmond’s evolving restaurant scene reaches the suburbs,2024-04-29,,
924,capitalnewsservice,0,https://starexponent.com/news/state-regional/generation-alpha-navigates-increased-screen-time-social-media-use/article_60970144-02fc-11ef-9fc9-1764c0189dfe.html,"Generation Alpha navigates increased screen time, social media use",2024-04-29,,
925,capitalnewsservice,0,https://www.timesvirginian.com/news/article_379c9bc4-01b1-11ef-9d3b-8ff3c52cb924.html,Virginia still without major league sports team after arena deal flops,2024-04-25,,
926,capitalnewsservice,0,https://whro.org/news/local-news/46751-debate-continues-on-va-bill-to-legalize-physician-assisted-death,Debate continues on Va. bill to legalize physician-assisted death,2024-04-25,,
927,capitalnewsservice,0,https://starexponent.com/news/local/lawmakers-reconvene-to-tackle-governor-s-changes-set-budget-special-session-date/article_c5406be2-fe76-11ee-b1eb-2f36bba826f2.html,Lawmakers reconvene to tackle governor’s changes; set budget special session date,2024-04-25,,
928,capitalnewsservice,0,https://newsvirginian.com/news/state-regional/youngkin-vetoes-bills-to-require-retail-warning-of-invasive-plant-species/article_90486ea6-f2d4-11ee-b5c5-1f497de0285b.html,Youngkin vetoes bills to require retail warning of invasive plant species,2024-04-10,,
929,capitalnewsservice,0,https://starexponent.com/news/local/wildlife-officials-propose-regulations-to-help-manage-hunter-landowner-conflicts/article_5fb4697a-f207-11ee-917a-4f10d1a4990d.html,"Wildlife officials propose regulations to help manage hunter, landowner conflicts",2024-04-10,,
930,thevirginian-pilot,0,https://www.pilotonline.com/2024/08/02/birding-extermination-of-vultures-also-kills-people/,Birding: Extermination of vultures also kills people,2024-08-02,,
931,thevirginian-pilot,0,https://www.pilotonline.com/2024/08/02/todays-weather-heat-index-near-110-severe-storm-threat/,Today’s weather: Heat index near 110; severe storm threat,2024-08-02,,
932,thevirginian-pilot,0,https://www.pilotonline.com/2024/08/02/today-in-history-august-2-verdict-in-black-sox-trial/,"Today in History: August 2, verdict in “Black Sox” trial",2024-08-02,,
933,thevirginian-pilot,0,https://www.pilotonline.com/2024/08/02/daily-horoscope-for-august-02-2024/,"Daily Horoscope for August 02, 2024",2024-08-02,,
934,thevirginian-pilot,0,https://www.pilotonline.com/2024/08/01/tides-surge-for-18-runs-dominate-charlotte/,"Tides surge for 18 runs, dominate Charlotte",2024-08-02,,
935,thevirginian-pilot,0,https://www.pilotonline.com/2024/08/01/two-hokies-one-cavalier-make-all-acc-preseason-football-team/,"Two Hokies, one Cavalier make All-ACC Preseason football team",2024-08-02,,
936,thevirginian-pilot,0,https://www.pilotonline.com/2024/08/01/olympics-tv-schedule-for-friday-august-2/,"Paris Olympics: Here’s what’s on TV on Friday, Aug. 2",2024-08-01,,
937,thevirginian-pilot,0,https://www.pilotonline.com/2024/08/01/former-old-dominion-sailor-partner-gain-final-spot-in-olympic-womens-skiff-medal-race/,"Former Old Dominion sailor, partner gain final spot in Olympic women’s skiff medal race",2024-08-01,,
938,thevirginian-pilot,0,https://www.pilotonline.com/2024/08/01/what-to-watch-shacarri-richardson-makes-olympic-debut/,What to watch: Sha’Carri Richardson makes Olympic debut Friday,2024-08-01,,
939,thevirginian-pilot,0,https://www.pilotonline.com/2024/08/01/4-las-vegas-teens-agree-to-plead-guilty-as-juveniles-in-deadly-beating-of-high-school-student/,4 Las Vegas teens agree to plead guilty as juveniles in deadly beating of high school student,2024-08-01,,
940,news7,0,http://www.news7newslinc.net/index.php/around-the-nek/3422-conflict-of-interest-for-h-829,Conflict Of Interest for H.829,2024-04-04,,
941,news7,0,http://www.news7newslinc.net/index.php/around-the-nek/lyndon/3420-police-advisory-committee-is-back,Police Advisory Committee Is Back,2024-03-21,,
942,news7,0,http://www.news7newslinc.net/index.php/around-the-nek/lyndon/3419-no-planning-administrator-in-lyndon,No Planning Administrator In Lyndon,2024-03-20,,
943,news7,0,http://www.news7newslinc.net/index.php/around-the-nek/3418-kesd-budget-not-approved,KESD Budget Not Approved,2024-03-18,,
944,news7,0,http://www.news7newslinc.net/index.php/around-the-nek/wheelock/3415-sean-cavanaugh,Wheelock Town Meeting Day,2024-03-08,,
945,news7,0,http://www.news7newslinc.net/index.php/around-the-nek/burke/3416-sean-cavanaugh,Burke Town Meeting Day,2024-03-08,,
946,news7,0,http://www.news7newslinc.net/index.php/around-the-nek/wheelock/3413-house-burns-down-in-wheelock,House Burns Down in Wheelock,2024-03-07,,
947,vtdigger,0,https://vtdigger.org/2024/08/02/after-a-half-century-on-the-sidelines-a-vermont-sportswriter-finds-himself-in-the-spotlight/,"After a half-century on the sidelines, a Vermont sportswriter finds himself in the spotlight",2024-08-02,,
948,vtdigger,0,https://vtdigger.org/2024/08/01/questions-remain-after-split-short-term-rental-votes-in-woodstock/,Questions remain after split short-term rental votes in Woodstock,2024-08-01,,
949,vtdigger,0,https://vtdigger.org/2024/08/01/planned-parenthood-projects-multimillion-dollar-deficit-in-vermont-new-hampshire-and-maine/,"Planned Parenthood projects multimillion-dollar deficit in Vermont, New Hampshire and Maine",2024-08-01,,
950,vtdigger,0,https://vtdigger.org/2024/08/01/bill-mares-a-renaissance-man-who-loved-vermont-dies-at-83/,"Bill Mares, a Renaissance man who loved Vermont, dies at 83",2024-08-01,,
951,vtdigger,0,https://vtdigger.org/2024/08/01/vermont-conversation-bill-mares-chose-how-and-when-to-end-his-life-he-had-a-few-things-he-wanted-to-say-before-he-died/,Vermont Conversation: Bill Mares chose how and when to end his life. He had a few things he wanted to say before he died.,2024-08-01,,
952,vtdigger,0,https://vtdigger.org/2024/08/01/dog-mountain-cancels-summer-festival-as-st-johnsbury-floods-wreak-havoc/,Dog Mountain cancels summer festival as St. Johnsbury floods wreak havoc,2024-08-01,,
953,vtdigger,0,https://vtdigger.org/2024/08/01/goddard-college-inks-3-4m-deal-to-sell-campus-to-a-local-community-group/,Goddard College inks $3.4M deal to sell campus to a local community group,2024-08-01,,
954,vtdigger,0,https://vtdigger.org/2024/08/01/susan-evans-mcclure-our-democracy-needs-the-arts/,Susan Evans McClure: Our democracy needs the arts,2024-08-01,,
955,vtdigger,0,https://vtdigger.org/2024/08/01/vermont-pursues-2-essex-locations-for-new-womens-prison/,Vermont pursues 2 Essex locations for new women’s prison,2024-08-01,,
956,vtdigger,0,https://vtdigger.org/2024/08/01/candidates-model-late-senator-mazza-while-making-their-own-path-in-grand-isle-race/,Candidates model late Sen. Dick Mazza while finding their own path in Grand Isle race,2024-08-01,,
957,vtdigger,0,https://vtdigger.org/2024/07/31/living-in-a-nightmare-on-lyndonvilles-red-village-road-this-weeks-storm-nearly-took-lives/,"‘Living in a nightmare’: On Lyndonville’s Red Village Road, this week’s storm nearly took lives",2024-08-01,,
958,vtdigger,0,https://vtdigger.org/2024/07/31/flash-flood-warning-wednesday-night-in-northeast-kingdom-as-rain-slowly-leaves-vermont/,Flash flood warning Wednesday night in Northeast Kingdom as rain slowly leaves Vermont,2024-08-01,,
959,vtdigger,0,https://vtdigger.org/2024/07/31/william-j-mares/,William J. Mares,2024-07-31,,
960,vtdigger,0,https://vtdigger.org/2024/07/31/vermont-conversation-new-york-times-reporter-peter-s-goodman-on-how-the-world-ran-out-of-everything/,Vermont Conversation: New York Times reporter Peter S. Goodman on how the world ran out of everything,2024-07-31,,
961,vtdigger,0,https://vtdigger.org/2024/07/31/vermont-delegation-implores-congress-for-flood-aid/,Vermont delegation implores Congress for flood aid,2024-07-31,,
962,vtdigger,0,https://vtdigger.org/2024/07/31/northeast-kingdom-sifts-through-flood-damage-braces-for-more-thunderstorms/,"Northeast Kingdom sifts through flood damage, braces for more thunderstorms",2024-07-31,,
963,vtdigger,0,https://vtdigger.org/2024/07/31/vermont-supreme-court-dismisses-complaint-in-accidental-covid-19-vaccination-case/,Vermont Supreme Court dismisses complaint in accidental Covid-19 vaccination case,2024-07-31,,
964,vtdigger,0,https://vtdigger.org/2024/07/31/how-to-fund-state-coffers-brattleboro-house-primary-draws-interest-with-a-taxing-debate/,How to fund state coffers? Brattleboro House primary draws interest with a taxing debate.,2024-07-31,,
965,vtdigger,0,https://vtdigger.org/2024/07/31/zoie-saunders-listening-learning-and-leading-for-vermonts-students/,"Zoie Saunders: Listening, learning and leading for Vermont’s students",2024-07-31,,
966,vtdigger,0,https://vtdigger.org/2024/07/30/torrential-rain-expected-wednesday-in-vermont-following-another-historic-storm/,Torrential rain expected Wednesday in Vermont following another ‘historic’ storm,2024-07-30,,
967,vtdigger,0,https://vtdigger.org/2024/07/30/a-much-more-intense-version-st-johnsbury-residents-respond-to-2nd-flood-in-a-month/,‘A much more intense version’: St. Johnsbury residents respond to 2nd flood in a month,2024-07-30,,
968,vtdigger,0,https://vtdigger.org/2024/07/30/a-divided-green-mountain-care-board-approves-new-uvm-medical-center-surgical-center-with-restrictions/,A divided Green Mountain Care Board approves new UVM Medical Center surgical center — with restrictions,2024-07-30,,
969,vtdigger,0,https://vtdigger.org/2024/07/30/state-officials-unleash-5m-in-local-flood-response-aid/,State officials unleash $5M in local flood response aid,2024-07-30,,
970,vtdigger,0,https://vtdigger.org/2024/07/30/brighton-residents-contend-with-damaged-homes-and-roads-after-latest-storm-brought-7-inches-of-rain/,Brighton residents contend with damaged homes and roads after latest storm brought 7 inches of rain,2024-07-30,,
971,vtdigger,0,https://vtdigger.org/2024/07/30/burlington-rugby-star-ilona-maher-wins-olympic-bronze/,Burlington rugby star Ilona Maher wins Olympic bronze,2024-07-30,,
972,vtdigger,0,https://vtdigger.org/2024/07/30/more-than-8-inches-of-rain-cause-flash-flooding-overnight-in-northeast-kingdom/,More than 8 inches of rain cause flash flooding overnight in Northeast Kingdom,2024-07-30,,
973,vtdigger,0,https://vtdigger.org/2024/07/30/in-purple-northeast-kingdom-senate-districts-candidates-focus-on-affordability/,"In purple Northeast Kingdom Senate districts, candidates focus on affordability",2024-07-30,,
974,vtdigger,0,https://vtdigger.org/2024/07/30/elena-mihaly-we-cant-tackle-climate-change-without-honest-math/,Elena Mihaly: We can’t tackle climate change without honest math,2024-07-30,,
975,vtdigger,0,https://vtdigger.org/2024/07/29/bernie-sanders-urges-kamala-harris-to-adopt-progressive-agenda/,Bernie Sanders urges Kamala Harris to adopt progressive agenda,2024-07-30,,
976,vtdigger,0,https://vtdigger.org/2024/07/29/june-violet-cooper/,June Violet Cooper,2024-07-30,,
977,vtdigger,0,https://vtcommunitynews.org/2024/07/16/underground-workshop-the-vermont-youth-council-is-a-platform-for-young-voices/,Underground Workshop: Vermont State Youth Council is a platform for young voices,2024-07-16,,
978,vtdigger,0,https://vtcommunitynews.org/2024/05/21/hinesburg-beekeeper-abuzz-about-proposed-neonicotinoid-ban/,Hinesburg beekeeper abuzz about proposed neonicotinoid ban,2024-05-21,,
979,vtdigger,0,https://vtcommunitynews.org/2024/05/15/house-lawmakers-kickstart-bill-for-next-year-that-looks-to-protect-charity-donations/,House lawmakers kickstart bill for next year that looks to protect charity donations,2024-05-15,,
980,vtdigger,0,https://vtcommunitynews.org/2024/05/13/wildlife-management-bill-dead-in-the-water/,Wildlife management bill dead in the water,2024-05-13,,
981,vtdigger,0,https://vtcommunitynews.org/2024/05/13/bill-to-defend-public-libraries-against-book-bans-passes/,Bill to defend public libraries against book bans passes,2024-05-13,,
982,vtdigger,0,https://vtcommunitynews.org/2024/05/13/bill-calling-for-psychedelic-research-sent-to-scott/,Bill calling for psychedelic research sent to Scott,2024-05-13,,
983,vtdigger,0,https://vtcommunitynews.org/2024/05/07/data-illustrates-the-hard-choices-ahead-for-green-mountain-transit/,Data illustrates the hard choices ahead for Green Mountain Transit,2024-05-07,,
984,vtdigger,0,https://vtcommunitynews.org/2024/05/06/lawmakers-mull-punishments-as-ghost-guns-bill-bounces-back-and-forth/,Lawmakers mull punishments as ghost guns bill bounces back and forth,2024-05-06,,
985,vtdigger,0,https://vtcommunitynews.org/2024/05/03/tucked-in-legislators-natural-disaster-plan-language-assistance-services-for-emergency-info/,Tucked in legislators’ natural disaster plan: language assistance services  for emergency info,2024-05-03,,
986,vtdigger,0,https://vtcommunitynews.org/2024/05/03/as-medical-cannabis-services-wane-lawmakers-look-for-solutions/,"As medical cannabis services wane, lawmakers look for solutions",2024-05-03,,
987,vtdigger,0,https://vtcommunitynews.org/2024/08/01/flood-mitigation-solutions-sought-by-cabot-task-force/,Flood mitigation solutions sought by Cabot task force,2024-08-01,,
988,vtdigger,0,https://vtcommunitynews.org/2024/07/26/all-aboard-the-railroad-in-american-art-debuts-at-shelburne-museum/,‘All Aboard: The Railroad in American Art’ debuts at Shelburne Museum,2024-07-26,,
989,vtdigger,0,https://vtcommunitynews.org/2024/07/26/not-your-average-summer-camp-civil-air-patrol-cadets-bunk-in-waterbury/,Not your average summer camp: Civil Air Patrol cadets bunk in Waterbury,2024-07-26,,
990,vtdigger,0,https://vtcommunitynews.org/2024/07/25/lake-champlain-researchers-pin-murky-plumes-on-flood-induced-runoff/,Lake Champlain researchers pin murky plumes on flood-induced runoff,2024-07-25,,
991,vtdigger,0,https://vtcommunitynews.org/2024/07/25/waterbury-residents-looked-to-fema-buyouts-after-last-years-floods-theyve-heard-nothing-for-months/,Waterbury residents looked to FEMA buyouts after last year’s floods. They’ve heard nothing for months,2024-07-25,,
992,vtdigger,0,https://vtcommunitynews.org/2024/07/24/nek-homeowners-and-recovery-groups-struggle-to-rebuild-amid-relentless-rain/,NEK homeowners and recovery groups struggle to rebuild amid relentless rain,2024-07-24,,
993,vtdigger,0,https://vtcommunitynews.org/2024/07/24/snowmobilers-look-to-rehab-flood-battered-bridge-over-the-winooski/,Snowmobilers look to rehab flood-battered bridge over the Winooski,2024-07-24,,
994,vtdigger,0,https://vtcommunitynews.org/2024/07/22/kids-from-across-the-u-s-run-away-to-new-england-to-join-circus-smirkus/,Kids from across the U.S. run away to New England to join Circus Smirkus,2024-07-22,,
995,vtdigger,0,https://vtcommunitynews.org/2024/07/22/cvu-students-open-farmstand-with-sustainability-in-mind/,CVU students open farmstand with sustainability in mind,2024-07-22,,
996,vtdigger,0,https://vtcommunitynews.org/2024/07/19/nowhere-to-go-migrant-advocates-say-deported-honduran-family-was-denied-asylum-rights/,‘Nowhere to go’: Migrant advocates say deported Honduran family was denied asylum rights,2024-07-19,,
997,vtdigger,0,https://vtcommunitynews.org/2024/07/31/vermonters-planting-native-gardens-to-help-pollinators-prosper/,Vermonters planting native gardens to help pollinators prosper,2024-07-31,,
998,vtdigger,0,https://vtcommunitynews.org/2024/07/16/in-vermont-vineyards-grape-growers-take-a-healing-tack/,"In Vermont vineyards, grape growers take a healing tack",2024-07-16,,
999,vtdigger,0,https://vtcommunitynews.org/2024/07/12/meet-the-faith-guided-leaders-backing-the-south-burlington-food-shelf/,Meet the faith-guided leaders backing the South Burlington Food Shelf,2024-07-12,,
1000,vtdigger,0,https://vtcommunitynews.org/2024/07/09/gravel-roads-tell-vermonts-story-top-to-bottom-on-vtxl-cycling-route/,Gravel roads tell Vermont’s story top to bottom on VTXL cycling route,2024-07-09,,
1001,vtdigger,0,https://vtcommunitynews.org/2024/06/27/officials-vermonters-should-prepare-to-protect-their-lungs-with-quebec-fires-expected-again/,Officials: Vermonters should prepare to protect their lungs with Quebec fires expected again,2024-06-27,,
1002,vtdigger,0,https://vtcommunitynews.org/2024/06/21/from-abandoned-blades-to-old-airplanes-vermont-surplus-property-has-bargains-galore/,"From abandoned blades to old airplanes, Vermont Surplus Property has bargains galore",2024-06-21,,
1003,vtdigger,0,https://vtcommunitynews.org/2024/05/29/tunbridges-town-nurse-steers-through-shortages-to-boost-community-health/,Tunbridge’s town nurse steers through shortages to boost community health,2024-05-29,,
1004,vtdigger,0,https://vtcommunitynews.org/2024/05/23/these-volunteers-are-helping-older-vermonters-care-for-their-pets/,These volunteers are helping older Vermonters care for their pets,2024-05-23,,
1005,vtdigger,0,https://vtcommunitynews.org/2024/05/23/program-to-store-carbon-in-forests-grows-in-the-green-mountain-state/,Program to store carbon in forests grows in the Green Mountain State,2024-05-23,,
1006,vtdigger,0,https://vtcommunitynews.org/2024/05/22/leaving-big-pharma-for-mushroom-farming-wiseman-family-finds-purpose-in-worcester/,"Leaving Big Pharma for mushroom farming, Wiseman family finds purpose in Worcester",2024-05-22,,
1007,kitsapdailynews,0,https://www.kitsapdailynews.com/opinion/more-laughter-needed-less-angst-as-i-approach-70-years-old/,"More laughter needed, less angst as I approach 70 years old",2024-08-02,,
1008,kitsapdailynews,0,https://www.kitsapdailynews.com/opinion/same-road-different-speed-limit/,"Same road, different speed limit?",2024-08-02,,
1009,kitsapdailynews,0,https://www.kitsapdailynews.com/news/po-mustang-enthusiasts-celebrate-60-years-of-iconic-car-series/,Mustang enthusiasts celebrate 60 years of iconic car series,2024-08-01,,
1010,kitsapdailynews,0,https://www.kitsapdailynews.com/news/silverdale-robbery-suspect-booked-in-kitsap-jail/,Silverdale robbery suspect booked in Kitsap jail,2024-07-31,,
1011,kitsapdailynews,0,https://www.kitsapdailynews.com/news/bainbridge-island-briefs-11/,Bainbridge Island briefs,2024-07-31,,
1012,kitsapdailynews,0,https://www.kitsapdailynews.com/news/kitsap-cities-relatively-unscathed-after-historic-global-outage/,Kitsap cities relatively unscathed after historic global outage,2024-07-31,,
